Nombre_pagina,URL_post,Recuento_compartidos,Reacciones_totales,Recuento_comentarios,Contenido,Fecha_hora_publicacion,Fecha,Hora,Estado
anahigonzalezqr,https://www.facebook.com/AnahiGonzalezQR/posts/pfbid0nP6pPPXznJ9Nh3QXvhmRzChxGhkZTuJE96nPFmvbJaKbt4PcKSjtvHQCxc2euoTgl?__cft__[0]=AZXg0zylFrbGr_tRl_lbFI9X3677eNPZW9I9U07LY1JFe0pXnlAm1dKdtpfYCGPN-UPkyVsoM2YJmtOzQFHghy0pnbya9YDcSfbk3A7T3FADgRiEKJP2x0pGXJf-m8k9TGHrPURR2C0CspxU_CTKrZe4XaFASsQbB1jT7NdCzT8HX6fZRix6Ji7XvnmvsIIEyR6wSUZsTkyn_YqCUcyfWl9l&__tn__=%2CO%2CP-R,0,11,1,"Con orgullo les comparto que fue aprobada por unanimidad de 467 votos en el Pleno la reforma de una servidora que modifica la Ley General para la Igualdad entre Mujeres y Hombres. Seguimos avanzando!El proposito es obligar a las y los titulares de las entidades federativas a publicar un informe anual sobre las acciones afirmativas y los esfuerzos activos realizados en materia de igualdad de genero.Ademas, mandata que la Junta de Gobierno del Instituto Nacional de las Mujeres tenga la facultad de promover, de manera coordinada, mecanismos que garanticen el acceso a la informacion en la materia.Para la 65 Legislatura Federal la igualdad sustantiva es fundamental. Agradezco su respaldo.#AnahiGonzalez #Morena #4T #QuintanaRoo #Mexico #Igualdad #Mujeres",2023-10-31T08:22:33.302329,31-10-2023,08:22 AM,NORMAL
crissalcerreca,https://www.facebook.com/CrissAlcerreca/posts/pfbid02EHPrp42fbKNuTy8s81b54ubXjs9CAcXVZcABw5aVJqnKrmtyrLB5enGmjSZxeonXl?__cft__[0]=AZV_S2NvXiZ4ltU3bHuDg6JQLRIiEVguOP1tC4FSI20MpqU2FSMn1rf82CmaYbBX73jAiqi5HxTKezaKjpU807gn06bz7-5TAKHGwmNlHvb-8ZUP_Taacoru3AldzM2uegMLjmXuYIR_R--u1eKi8ZJJWicw0_TSKnRlcjXtGqEWgU19nQuCehcBvVCk09nwd6JKpmYkdl145yWOHRmP61b2pTBgaIfygURNiSH5ley_5_XbSg8oZFix7tkAqvFspnU&__tn__=%2CO%2CP-R,0,0,0,"Reunion de la Comision de Justicia.Para tratar los asuntos siguientes:Estudio, analisis, discusion y dictaminacion, en su caso, de la Iniciativa de Decreto por el que se reforman y adicionan diversas disposiciones del Codigo Penal para el Estado Libre y Soberano de Quintana Roo, de la Ley Organica de la Administracion Publica del Estado de Quintana Roo, de la Ley del Servicio de Administracion Tributaria del Estado de Quintana Roo y del Codigo Fiscal del Estado de Quintana Roo; en materia de investigacion y persecucion de delitos de operaciones con recursos de procedencia ilicita (lavado de activos); presentada por la Licenciada Maria Elena H. Lezama Espinosa, Gobernadora del Estado de Quintana Roo.Estudio, analisis, discusion y dictaminacion, en su caso, de la Iniciativa con proyecto de decreto por el que se reforman, derogan y adicionan diversas disposiciones a la Ley Organica de la Fiscalia General del Estado de Quintana Roo; presentada por la Licenciada Maria Elena H. Lezama Espinosa, Gobernadora del Estado de Quintana Roo.  Fecha: 31 de octubre del 2023.                                                                                                                                                                                                           XVII Legislatura del Estado Libre y Soberano de Quintana Roo ___________________________________________________________                                                                                                                                                                                                                                                                                                                                   Aviso de Privacidad Simplificado.                                                                                                                                                                                                                                                                                                                                   El H. Congreso del Estado de Q. Roo es el responsable de los datos personales que se recaben durante la realizacion del presente evento, garantizado su debida proteccion.                                                                                                                                                                                                                                                                                                                                   Consulte nuestro aviso integral en www.congresoqroo.gob.mx",2023-10-31T08:23:35.779466,31-10-2023,08:23 AM,NORMAL
crissalcerreca,https://www.facebook.com/CrissAlcerreca/posts/pfbid0Fe8tidjSDgwYwV8HARMr4B7RDqkJeEUTPwF1xsvx8yMDUX5xG8CconSt1eLDUgbYl?__cft__[0]=AZVECE6V2TIvvw7WFdZ894hQBwh7GRfrEpq_NjttIWHhBO4XNkeX9QhNFhl5-V-mKapPSFaWophLYnH0p5law79ELdxQ30FaeHAml0fzSmcGZKOUWhKTnWkWZBTw6_4cALjURdhCd03vY2RWA-VwUU9DpJ7mhF5E1i6K9pkyqF_lrf04AipcUPjHHV_OBw27IODhceno0Ls5aedYlShnpLAx&__tn__=%2CO%2CP-R,0,4,0,"Este lunes, en nuestra sesion ordinaria numero 20, tuve el honor de participar en la aprobacion de la reforma a los articulos 12 y 17 de la Constitucion Politica del Estado. Esta iniciativa, que surgio de la vision de nuestra gobernadora, Mara Lezama, marca un importante paso en nuestro compromiso con el reconocimiento de la dignidad humana y el derecho a una buena administracion publica. Estamos decididos a avanzar hacia una transformacion significativa del estado.#LegislarParaTodos#XVIILegislatura",2023-10-30T23:08:41.003505,30-10-2023,11:08 PM,NORMAL
crissalcerreca,https://www.facebook.com/CrissAlcerreca/posts/pfbid02c3Y6kknESSXz7mP4uFfPRs3L1zkbCA8GychMeZ856ULC349adCb2CyVPx4avNuJTl?__cft__[0]=AZW8k-6n6IfNUr74LFkRz97hw-Juf7voJ1blmWrff7V26swTrAmPSHMMBjiRPWcs8ehOO1r8r8xyPI_4rT4-n-VtYTRPUOeUqbAOMbg4r9Osui1RI7IU6eMsUTboXV4nctBio0ErN9adIoO1wNBPz8ITpr7Kmx0pF0JZcUsYf-LAVoKSkHIBoqB8RvpZF_BPQad43yw_RsHBasL-_i2I16O6&__tn__=%2CO%2CP-R,0,4,0,"Feliz cumpleanos mi querido Marco Polo Carballo!Espero que en este dia tan especial te la hayas pasado super bien, consentido y lleno de amor. Que la vida te siga sonriendo y que sea una vuelta al sol llena de bendiciones.#felicidades",2023-10-30T23:08:41.076889,30-10-2023,11:08 PM,NORMAL
eriknoeborgesyam,https://www.facebook.com/eriknoeborgesyam/videos/233432776420726/?__cft__[0]=AZWRSafIkMm6Z6PhUo1mrI7U_FgourXWKLsJQPcp9q3DVLIc9wSp9Wta-BWIAVc_QpLPDnoFWvAHgiN4KRI0W6rEBIhtQW8orV4S1XH1rEsaMUSVi9_AkU2HasPzc32iM2rieGADgxLgyywJZfA6I_Lk0avIvVaCZcTSsnrkEunk3tqrm2ACb9nEK3l0M34OtzvoUDMNRmR_-h_3UzvQXeqS&__tn__=%2CO%2CP-R,91,68,17,,2023-10-31T08:12:25.124716,31-10-2023,08:12 AM,NORMAL
maralezamaoficial,https://www.facebook.com/MaraLezamaOficial/posts/876980323798733?__cft__[0]=AZX5PBvduKszN2e8IutVDqTO61Z7esw2c1hZYsQB21DdCxtxGFH-MiYtwYpMrFMrlFgIwU5oDHpMiUHw8RSo2_CFef9Vfn5wbgUuTm-ofbQW4dd6M2vdqoeD-s3cBJNuzdKei1ajme8PbL9-bGvXcxy46Q8YU6ae5_okUElghIno_jdqrF0ysv_0cpVtoHhz9Jwn5Q3BddKRhJr35Njbxakx&__tn__=%2CO%2CP-R,532,2944,318,En camino las primeras 50 toneladas de ayuda para nuestras y nuestros hermanos de Guerrero. Quintana Roo esta con ustedes!,2023-10-31T08:12:49.701584,31-10-2023,08:12 AM,NORMAL
juanitalonso,https://www.facebook.com/Juanitalonso/posts/pfbid036NGuU3s58r3pT1NbisYhoZbNnSm87mCph5328Q1XYZEeWWt6a3AXkyBnbB2TAJRvl?__cft__[0]=AZXu5peIyHVi4-cWM3HMH54McDqZ2R0oS8knEIC3kNzlJOay4IiqSD4nKcP5jXYN4ETEsVENfjZgQQ8GC-FavF7DIV-FzVt7aAWB_nutlHYS75fLHmDa2fC5USXXxROrC7W1Dhl8HPvBuLdJWA_rQS5Im0xoku5Hm_KkYctcjiiIOgOHO72UzREHELdmRHdcdbchvvgr6iIi83CBKQELtIUi&__tn__=%2CO%2CP-R,0,38,6,"Muchas felicidades a las ganadoras del concurso de catrinas del tercer Festival Dia de Muertos Almas con Tradicion Cozumel! Categoria Infantil Primer lugar: Alexa Ximena Castillo Rodriguez Segundo lugar: Shayna Nohely Sabido Cahuich Tercer lugar: Alinna Karolina Fernandez Custodio Categoria Juvenil Primer lugar: Sofia Nazaret Ventura Santana Segundo lugar: Pilar Angelica Mukul Catzin Tercer lugar: Maggie Guadalupe Choy CanulGracias a todas las participantes por enriquecer nuestra comunidad, fomentar la expresion artistica y contribuir a la preservacion de nuestras tradiciones.#UnidosSomosMasGrandes#DiaDeMuertos#AlmasConTradicion#Cozumel",2023-10-31T08:11:56.794138,31-10-2023,08:11 AM,NORMAL
dhcaguakan,https://www.facebook.com/DHCAGUAKAN/posts/pfbid0jBLNEejMd6Sm7hEMHnRgcaqSL5mwkvQHUxPW9Y7gcuj6yz7r9LqcuZRAPFDJQGgol?__cft__[0]=AZWJdIVX7FPihmbWU5ZkHGrxX6czMAXsZCiGaCDAoBAnL150GbL7x_VUaLRFcOsuV0Zs2RpsFJ9Ht1gu4DoeSd_va6CA72UG_4ZvdzYpGgET4KZ_QPdvYrGel4WSMme0vb1wrpLYkcOof9pJecKgQGDUZwhHFL7H12g_7qUykwzEfnvuHGWU_fRPhucdUffRD7LTbhjtDNwPDb1mabk_rtC5&__tn__=%2CO%2CP-R,0,0,0,El equipo de Aguakan se dedica incansablemente a diversas tareas cada dia. Son el motor que impulsa el suministro de agua potable y la gestion eficaz de las aguas residuales. Su esfuerzo diario se refleja en el bienestar de nuestra comunidad. #ColaboradoresEnAccion,2023-10-31T08:12:18.806619,31-10-2023,08:12 AM,NORMAL
sheffieldgto,https://www.facebook.com/SheffieldGto/posts/pfbid0pQB4kecPzXFvW9W81tiKR7ameXf2jfRbHNpjtvjMi95sLk2XDxstFpwanwftQpkMl?__cft__[0]=AZWYFXQ2S1DhUzXdIq8RKwr9ALesS3Jy_iszvN9JoeBFUnav8sSOtw-VUlRma5Ehkh65WgdEfWgnHKuva-AiJSyxXO4_TScwNbC7yGqJRm5V_xV9_GcMuB-QX7DR2W6kEaV69szqj64y4ZkVj7hxNQnnOyKW2WtrCIvPOOhy8MpDp0VRTremgKcG6JAI5p8l5cAFdb3rn-L3YDWauVXNoKE1&__tn__=%2CO%2CP-R,3,56,4,Con todo y por todo! Hasta recuperar el estado por el que los guanajuatenses tanto hemos trabajado. #LaRutaDelCambio,2023-10-31T08:47:38.419043,31-10-2023,08:47 AM,NORMAL
ayuntamientodesolidaridad,https://www.facebook.com/AyuntamientodeSolidaridad/posts/pfbid023TYeW9hSEZuTA6anKwD4uDByhiwvqLDah39GTLcfNjaxNSDkLja5A7dVU2cZ9Hwil?__cft__[0]=AZW8hRDgogwEDG-Kq3nXXUJXiczgqsI87dFdTyyQcylYOZ0MqS9AJYgLdp5rSwnc-k8cfG1ghOdhiv06_AVhtX6FDQw4tmUSDhLL_eRY056MfMAwKtdygVh1ouweFcGGN4eeukDbxEtK_YImCDfYrvV78reOgvO8dmrqKT62kQj7EqWlLr66nlcyDo_KoV6nh0t7IxoA6TXCF92Ak3SlEwsK&__tn__=%2CO%2CP-R,0,2,1,Estamos renovando #PlayaDelCarmen! Conoce que significa cada elemento que estamos pintando en las avenidas. Si todos respetamos los senalamientos tendremos un espacio seguro para transitar! #RenovamosParaCrecerConOrden,2023-10-31T08:30:36.383568,31-10-2023,08:30 AM,NORMAL
100092238522976,https://www.facebook.com/permalink.php?story_fbid=pfbid02cvRohxr7DqCuTs2xXAWZaNZnFGe83rzTk99eaaK76aWYcTQfRGq84qaUuxjShDBUl&id=100092238522976&__cft__[0]=AZUiNLAPaFebajb5GqKVyetiGJ_abDbSffln3X2ZMIgSC-0osLGykOnycuwYzon29BJy3Kcc6V0Eu_gfP8oWCfGzTs-G9UUOrEGuQxKZFXe3VGtDoLrQMJp1tVE8OopbgyK3jXx3RdJ7kdSu_VUyvOm4XZc8ut5DjW1OHVOqgFhvVWd-cXdXmJvXn1sNjv2nvs3AhLIYlIG5zpy8mNgiobtU&__tn__=%2CO%2CP-R,0,3,0,"En #Coyoacan, primero tu!Mantenemos la esperanza contar la alcaldia de nuestros suenos. Sigamos trabajando para que los servicios publicos lleguen con calidad hasta el ultimo rincon! #EncausandoCausas #ServiciosPublicos #PrimeroTu",2023-10-31T09:02:25.608080,31-10-2023,09:02 AM,NORMAL
ptomorelosayto,https://www.facebook.com/PtoMorelosAyto/posts/pfbid022mMeCLKGkq8yUGedwNw51yrMTDcpYsZHkTYSGhrQtPF4JQ6T6Gh9zKM7BhxhRxqMl?__cft__[0]=AZW3N8ubX5msTzGNS2zBAa1NlAbmgUMnOb-HDt5UfKZsAqPVHLr0MXOHXQF3-X9PrbUhVz0HZQ6pJQvVoqY23RI3g3Q6lP2oaVW7uLU13a84QKxyB3eXZ3Ez7YFNi8OPpQFQOJHcSakcjrz6NXyLx_tydx3YMGafCW8-cY11yrFqVdnajFKX8UD3RrfAlxOpbsY7lju1d6X4jSjveSN2L4W4&__tn__=%2CO%2CP-R,0,8,3,"#PuertoMorelos preserva las tradiciones que forjan su identidad; la Alcaldesa Blanca Merari Puerto Morelos participa, junto con habitantes de la localidad, en el Paseo de las Animas y premia a los ganadores de los concursos de catrinas, calaveritas y altares.#GobiernoCiudadano #CercaDeTi",2023-10-31T08:12:59.727904,31-10-2023,08:12 AM,NORMAL
ptomorelosayto,https://www.facebook.com/PtoMorelosAyto/posts/pfbid0Y8VMwPwqxBM2L6GmXDkt5tns7qNQNF997DMyWF91yuB55cW2xcSFtsRGhk9HTvebl?__cft__[0]=AZU6pTU5eBNwSwBFqqKrpYjIqplCWGorAXA0VyFlHpub_H5ThGHizgw5vD6Oe9sNqGEBoa7f9DPMo2PcbPdaJI__FI_lhM2hlBYh3-UgRaYV42s6R4-9at50Pbf0FnQK8D0tD9P3mUbPrJODx2OVntceRVegp2kv-TRCzSckQaUOyViY0GBjCNuxgDcvI1-mnoQL5ND8nATMgKxlSIsCrn7h&__tn__=%2CO%2CP-R,21,22,6,"El #DiaDeMuertos es una celebracion ancestral que honra a los seres queridos fallecidos, a traves de los altares se cree que se tiende un puente de comunicacion entre ellos y los vivos.",2023-10-31T06:13:07.687323,31-10-2023,06:13 AM,NORMAL
eugeniosegura.oficial,https://www.facebook.com/EugenioSegura.Oficial/posts/pfbid02PEucFNwfgv4cCVeR1NssEdd3RKeHvDcf5EhLzgpF4BoRYatFSAeW2wy2hGgb1MB1l?__cft__[0]=AZXM_wTB9xHk5ENaT9N4Am5vQ0lRNM-AohuMG2QHJyJGPKjoXTvoRNbhlY1y0NTbqCgMuekRr4e6otuoy0NFH_jxzSnn_FGi2knCJvc5txsvApPXdzNsLr0UiFy6RokBizwuASLRgNLMb4xmhWP2rWXJEeQaWxImh81xWNuH08JIfO3dLgynyElTVIO-mYhpXZVTJW1ruhT2C5bK3CC106TMQbUh7iLsZU5RseTHWRVwZ6tHEd_2ErHpCaZWYpGX5eDdo4yTex4PCB0232uJFvlLsgQNSrF76aoNgViX1jSlTQ&__tn__=%2CO%2CP-R,0,0,0,En camino las primeras 50 toneladas de ayuda para nuestras y nuestros hermanos de Guerrero. Quintana Roo esta con ustedes!,2023-10-31T08:31:29.433848,31-10-2023,08:31 AM,NORMAL
ricardovelazco2022,https://www.facebook.com/RicardoVelazco2022/posts/pfbid02L2vVLEdUg59EaDJb5AzYR146ypb7z2erYqsmqcVCqmhTErH1cZo6evSGfwGsmd19l?__cft__[0]=AZWu358lQGanaMMpS_bvenIXGGh_DEs9w0rJRCu9Q_JHYsvs_90TkxG58j8mjG9O-MCl679b65GpSQ85nh9u6KqrJAE7yPKkGW382OwTT0_in4QErDbCRFoyzw6sr8jIRZthElZsDXNyUPJWAczpIKpE4WVD9PVPwqlE5Qf3XeX43-azAlq_Yx5kBVy9BTKsQ3aqwih6DFUoIiOG1Fd0GoWU&__tn__=%2CO%2CP-R,54,18,4,"Presente en la Reunion de las Comisiones Unidas de Deporte y para la Igualdad de Genero, con motivo del estudio, analisis, discusion y dictaminacion de la Iniciativa de decreto por el que se adicionan y reforman diversas disposiciones de la Ley Estatal de Cultura Fisica y Deporte; la Ley para la Igualdad entre Mujeres y Hombres del Estado de Quintana Roo y la Ley de la Juventud del Estado Libre y Soberano de #QuintanaRoo. #UnidosParaTransformar #trabajandoconelcorazon",2023-10-31T06:13:36.636628,31-10-2023,06:13 AM,NORMAL
jorgesanencervantes,https://www.facebook.com/jorgesanencervantes/posts/pfbid0vHTQ1zA79SqWmApZ3mvWZcbjnmngJ6PHKRuCVsRX4d98TxLTiUrowwZMyMYPhxWxl?__cft__[0]=AZVs27KOH6tl9yE9MWdeyuAYoTGqjabX_kAXDFLs6YnUXXN0CtUJa9uAuZ6z1GyXuHSZT1az9hFWYrhEvA8ZdFGy8ESNQzNafuV2LkfeskNxAQVHdA3EXmqOlmo92POXQcis3-1gTSSyFYWoHE1r5t02dP5ElJ2Gdaxp5Wb9awKei7rV1ULOgYxAfvAFmYiURb_plNch9c4rIdy7BWwfSzRV&__tn__=%2CO%2CP-R,0,7,1,Con esfuerzo incansable y en unidad podemos lograr ayudar a quienes mas lo necesitan.Son tiempos de apoyar y este gran equipo sabe que podemos aportar con lo mas pequeno.#HuracanOtis,2023-10-31T08:59:37.022596,31-10-2023,08:59 AM,NORMAL
lululatife,https://www.facebook.com/LuluLatife/posts/pfbid025SmDMxwffhhmVStjU1uymWoUsfTiLF1q1hpHK99oBbho8CivBQcdvHd6GUp2CdLSl?__cft__[0]=AZXaHuNd0TQ-_jnHF5ZSKSKnTOLFW7R7WOae6x28mZ3RadfPJt-CjYo6ilUMav8W7o285LjZbmaszjRNxtl-Q8_GUI_8_dmVNeZW6qww6wwQUvPTYrz0G774gnLiUKl_5asfwYAME5q_FVgJiWmE-ysoTEnqwa69BVnk9HUpvlzzXqdjFk-33XXImvDuFKgPb-GZAgk1DGbX-rQ-_ozPKgYa&__tn__=%2CO%2CP-R,0,4,1,Agenda del dia de hoy martes 31 de octubre 2023 de la #PrimeraRegiduria de #Benito Juarez.Continuamos con nuestra labor con las y los benitojuarenses!#L4TIendoPorCancun,2023-10-31T08:31:23.121781,31-10-2023,08:31 AM,NORMAL
lululatife,https://www.facebook.com/LuluLatife/posts/pfbid0257ehwGE1Mx1KBbhLBGMTUPwwVRdSRMxCnJeJNJC2gMMowje54Hn273yTXNAZxWMcl?__cft__[0]=AZXQwaiS9DXGx3O1Pt6KpltLdmimKrFP-rvOPu0bHeCiORLwV2hFikspKT9xRPbgKCg4PY4TPMrLw5ftUZU5QEA0uFzSeG0qaADAWWshDUYAKxUvur7mzQ_IR5i2QGXrNoV90Fn0wMYPI4u1x6aRrZnTqILhoHsK3TFCXtASbNwsDyd1VH5bk95LoNvsXZCzy3Iidg51K_iZccZAqKnN_zl_&__tn__=%2CO%2CP-R,58,20,6,Un dia para recordar y honrar a nuestros familiares...,2023-10-31T07:13:28.702803,31-10-2023,07:13 AM,NORMAL
lululatife,https://www.facebook.com/LuluLatife/posts/817803963683857:1045446939930051?__cft__[0]=AZUV2PwXd734gy-nPc5Btpd5kaetGJ01R63wfrQaRi7XS4ZloD_Wx5fTw71ewJIdwnsCAZFJ7Sb1wRDB1JOR63bVWMzz4QQPUQfWk3fKOaW32edkEi2UoyW8DsSvPS8J7Dyk_Udul647NfK4ltZ6kOv9q-lgWRz4RBkK7TILYA2VSR-X0K948ELVifgNGDRloHGk06bgrlZ3kdUkGzJweBHefcT9nLrSKQMdMY5E14jUaA&__tn__=%2CO%2CP-R,3,19,1,,2023-10-31T00:13:28.938174,31-10-2023,12:13 AM,NORMAL
lululatife,https://www.facebook.com/LuluLatife/posts/293535793585777:293535793585777?__cft__[0]=AZWf-Bc1sXtIzW6X8lQzSByY4X2B7ymPitC5bQdTfHPia2xJyq4FbypNf6m4soRMLW0zX48Bp3mio0cDuPccXe1JEaPjoWhX82Vm6YE9K0W53P_EB686ZdtpDmSy6NrUGBcuV_TKuzlL8FXcfRD9TDNuxSAnyKJJiFgy1DXZBecIPjU61C1267uvg4wHiQPJbMFnPVJgjI0KbYcGBzKBd4hV&__tn__=%2CO%2CP-R,1,21,1,,2023-10-31T00:13:29.191496,31-10-2023,12:13 AM,NORMAL
oscar.cantonzetina,https://www.facebook.com/oscar.cantonzetina/posts/pfbid0mnotBkYmGkkV9GjrNyGFsFdeekVPqfzRDVQriEdPJEQZaFTx8YwQa9ke8y5jMVqql?__cft__[0]=AZWnUHJXi-lvH36xOSaWVOMSnkXH0j4OHUAhBvKVpUk8d5pvWh6LWp-VTC8ZH6OEADHYmvoQYyNbm69dabu0DxEzhFz1AahLfVs_9VptgGcQfBparpAwHGGITHHYiLyEleUJxSyZ9zJnn4T3RM2kMWRaNFTFlWirgx-SLq7rNAGsv5rdZ1aKI-rsj_2UtZXHYrudBEenjNc45Sy9_Ku1LxQl&__tn__=%2CO%2CP-R,2,5,2,Los intereses del pueblo deben estar siempre primero!!!#Canton #Morena #Encuesta #Tabasco,2023-10-31T08:30:39.149908,31-10-2023,08:30 AM,NORMAL
100071257616496,https://www.facebook.com/100071257616496/videos/359742363066962/?__cft__[0]=AZXJJktNbJyr7Vtc_8GeLkBHgyRbLum6TVSaujqUUxAeSG46XstI0PwGyHExtj5tB82BIN4hjDnN8nO4hPDThxgibYgW2cnt-y3HcqDQ1HIwaUizZ5myJS-_HlaMNEaHcHrFON-JZjcb8jbMXDolkuCfeGOtkRN51pEBqic4L3s7OzsUHAvXy8F0XiA_gIIaZwuFQT_9YJc92HZ-wcwgTo_f&__tn__=%2CO%2CP-R,9,66,26,,2023-10-31T08:13:39.631620,31-10-2023,08:13 AM,NORMAL
hugoaldayn,https://www.facebook.com/HugoAldayN/posts/pfbid0fNjJyGAcKJwtQUTjxdik5CWkiCRL6Jf4bKG8tGXzc5vFxPU1nvhftGEhZcWiTHLzl?__cft__[0]=AZUFU8uEshosIwGsjV3x1HzUANzxTAlk_6BbYKWPn8g6CzVKRzvusArvJKEh1Xtf4LM9gvS74ouZIb8HqwyuUK0qfrfaGUdKAlOSZtz5e6gzAqOQ-4d1NCxUTUFBZjXfNf3vP-RTtvrDefJ0jv_ks3EUtB9t7rgbDgRJJZ4vZMK5qc0eSCyNS2rL1Xq1AdAsm6mguy8CT7tGrIAR73b_Fd7EEpBrSvgzNPF2DCRIaMK0R_fghfBH2F2yalAxbnIldOM&__tn__=%2CO%2CP-R,1,2,1,"Reunion de la Comision de Justicia.Para tratar los asuntos siguientes:Estudio, analisis, discusion y dictaminacion, en su caso, de la Iniciativa de Decreto por el que se reforman y adicionan diversas disposiciones del Codigo Penal para el Estado Libre y Soberano de Quintana Roo, de la Ley Organica de la Administracion Publica del Estado de Quintana Roo, de la Ley del Servicio de Administracion Tributaria del Estado de Quintana Roo y del Codigo Fiscal del Estado de Quintana Roo; en materia de investigacion y persecucion de delitos de operaciones con recursos de procedencia ilicita (lavado de activos); presentada por la Licenciada Maria Elena H. Lezama Espinosa, Gobernadora del Estado de Quintana Roo.Estudio, analisis, discusion y dictaminacion, en su caso, de la Iniciativa con proyecto de decreto por el que se reforman, derogan y adicionan diversas disposiciones a la Ley Organica de la Fiscalia General del Estado de Quintana Roo; presentada por la Licenciada Maria Elena H. Lezama Espinosa, Gobernadora del Estado de Quintana Roo.  Fecha: 31 de octubre del 2023.                                                                                                                                                                                                           XVII Legislatura del Estado Libre y Soberano de Quintana Roo ___________________________________________________________                                                                                                                                                                                                                                                                                                                                   Aviso de Privacidad Simplificado.                                                                                                                                                                                                                                                                                                                                   El H. Congreso del Estado de Q. Roo es el responsable de los datos personales que se recaben durante la realizacion del presente evento, garantizado su debida proteccion.                                                                                                                                                                                                                                                                                                                                   Consulte nuestro aviso integral en www.congresoqroo.gob.mx",2023-10-31T08:35:39.740329,31-10-2023,08:35 AM,NORMAL
blancameraripuertomorelos,https://www.facebook.com/BlancaMerariPuertoMorelos/posts/pfbid0dWPoEDUBNmAy5ZQi5B72bzjqHMP8Ucgz1eEkPmC24jtLVPa1TuQAx3TkvHNk68Mhl?__cft__[0]=AZWYf5Q_BFZsI3o1McgNTgHjsLy_xuzgt11MPnw_mCoIxh_7PUkyAmOsoZArgPTMgV7_bESgCKOXSuCVFeJ6PGoUZf4vjxuIVSHanfzngPUNYhQg26s6f2TYBAcNDiAPuKBCHt_-c7LqaF-JTr_vALPPvJmVS9pMdykeKYtofD3xV4iRNFY6TR5sdKEj4x_VMtXy4sKkVxbP2zP4swGchob6&__tn__=%2CO%2CP-R,11,43,5,"Buenos dias amig@s!Les comparto como estuvo el primer dia de actividades por la celebracion de nuestro Dia de Muertos, en el que pudimos observar el elegante andar de coloridas catrinas, apreciamos la creatividad de los participantes en el concurso de altares y disfrutamos del ingenio de las calaveritas literarias.Puerto Morelos vive en sus tradiciones!#BlancaMerari",2023-10-31T08:13:44.434777,31-10-2023,08:13 AM,NORMAL
soyanapaty,https://www.facebook.com/soyanapaty/posts/pfbid02MvTgHWdRpv1ZNFSBKsAukzqXSnbxGuVKzFUfZu1PYe6chCLb54c1oQW3TA2M2bjhl?__cft__[0]=AZX6hNA2XMS4J3co7LTYqkwwfwbfZ0AU248A9ZqmMTTaa6G9ijJWDv-vlcKSMfyYrd1YN9QLylKAPOm5RIMXnM6Fhq6COkGOAfkS90ERGYvHJ008yxqYfJF7DcZ9Ef1ayt7_le5kY7hYk46IF5gx5S1AfRvpXh50Hucw8B6iDt_2d-wh6mCGx9QDMqs-KWfEfgC1jhfPKemhVJQUVkfhZ-C4&__tn__=%2CO%2CP-R,4,11,2,"En Villas Otoch Paraiso pondremos nuevos contenedores de basura para continuar transformando nuestra ciudad. Pedimos a todas y todos los vecinos a sacar la basura en el horario de recolecta y embolsar su basura para que asi, nuestros espacios publicos se mantengan limpios para las familias cancunenses.",2023-10-31T08:36:46.487288,31-10-2023,08:36 AM,NORMAL
soypablobustamante,https://www.facebook.com/soypablobustamante/posts/pfbid035pGzJfj787DJYPNbDZi46dTuS5JpZfM8HNXcAG6mFoxq5M61mhtpXjJNwaZvZvcil?__cft__[0]=AZXfxTyqajFmTC7eQFAcFh8txQRJQiNf9F65WNYLYfTlvvlFu8TgM-T7CmiBLfrJZUxqzCPoVPA1-uEuIqH0ms0FI1_8cCAWNxn3zKH9sPd4qZVV9xNlsBXMuGdGB__V0OV7IpCzVTtI7e5Ow5PP9DvVdww-rSb7FnMqQ8eygs_AddTn0Flp0oKhwecRzEnEpeKC6LraNDFWn2SGkWONT7yU&__tn__=%2CO%2CP-R,126,78,36,List@s para recibir con un tradicional #PIB a nuestros seres queridos. #HanalPixan #DiaDeMuertos #Mexico #QuintanaRoo,2023-10-31T07:13:49.435685,31-10-2023,07:13 AM,NORMAL
temistoclesvr,https://www.facebook.com/TemistoclesVR/posts/826963976097278?__cft__[0]=AZW2paabphVk5ltRAVFTZzurLhDs_oDeV31NCncZhd8yXMlmxRll2SY_44kO6Pg_donGzSnXDV6h8Sx3sbMOX4NCqh4BjAVpzekY-f4VsHhlyHJADaC2_nzZzXolTtYiS69yrKVqlqRipdWkUZ4aYvV6Uydi4TjAJF84oSbI__r5b33RMDQCsdp-LxOqAhLME121SzToHAHCE4yfy9SNf2-v&__tn__=%2CO%2CP-R,0,16,2,"El primer dia de la semana lo termine con #AsambleaVecinal en la #ColoniaObrera, donde escuche sus preocupaciones sobre seguridad, atencion al espacio publico y el cuidado del medio ambiente. Me llevo sus necesidades para atenderlas y gestionar prontas soluciones. Agradezco su asistencia y participaciones. Todos sus comentarios son indispensables para trabajar por una mejor alcaldia. Sigamos trabajando de la mano. #SigamosConstruyendo una mejor Cuauhtemoc.",2023-10-31T00:14:05.179724,31-10-2023,12:14 AM,NORMAL
mariodelgadocarrillo,https://www.facebook.com/mariodelgadocarrillo/posts/pfbid0RkV8zkuQduUXdviLWUj7JHchZHt4H76T4bAFoHoyZwqpZkSiD1L8gN3bhbWAeiYCl?__cft__[0]=AZWMWVE2U1yNlbagM9AkZTIOBgpwO3WVZoeg_WDZa0oup90X_C0630GH6pAy3OLsRSZLLRWw-BG-NOism95omIxQkSYxowu_2bCm8KvABPK6xL3IOMzbK1AFQsGk-pZtAARIeh2WEbipwo3T7CryIiSaAA0W9xmuWB8edC3YKUQ0EsmVesgFwbXkJZVN651kxDGFy-lW_-0ouE-YWVeCPcLuqKNuhmRbdllShoHA3znvwg&__tn__=%2CO%2CP-R,17,273,31,"La Dra. Claudia Sheinbaum, Coordinadora Nacional de Defensa de la #4T, nos acompano en una reunion interna. Unidas y unidos somos mas fuertes!",2023-10-30T22:17:08.354628,30-10-2023,10:17 PM,NORMAL
benjaminricom,https://www.facebook.com/BenjaminRicoM/posts/pfbid0nZoZuFVumCU8kdtgnKyyzsczZjGKKSZse57TpUNHkUG8zHwLjTQUYPD6smyCPZysl?__cft__[0]=AZV3sLRr7nMV-wh0xXHRmCOP3b1OL20Kci9kyd_W_B2pwSdu7QVluExMlH8IfmGMLKtTUAPW0awhtm8hEIo28PPD4wuCrPHHVLp-wB9frsMZW7IY2-L7wsdGXtkgNrlNaJa_SEtW8YyrBHDxpXEE2jOaxCCDL7pV-NUS2LdtAKRloLvp6RZav827tWSho7mQ4FuSFxlvOt4M4zHSOvP4zQpK&__tn__=%2CO%2CP-R,11,94,22,Este es el #Pachuca de mi corazon  ciudad por la que todos los dias damos nuestro mayor esfuerzo. #ExcelenteMartes #ADarle,2023-10-31T07:17:51.426979,31-10-2023,07:17 AM,NORMAL
renansanchezt,https://www.facebook.com/RenanSanchezT/posts/pfbid0q271hKvFRkA9n19kKtNfcofcp3J2L9npCMr2j6FnQKSSEo4ic27mzDhnCYEcoWRKl?__cft__[0]=AZWsQgvpwERel46ZGlvICuc1SDvGLOQEorTPrWUTCM7miyyQeE5mYCJ4edvH_zPWhYNVxIay3fNeXdmYOXbh_e4-bqROK_aKOUOdLC3JMjFQEFvZznWTHegwzSXavD7w0pdrntg0dU0ferLaRpWm0jJiBx_MkYg7SlryVw7ykEQxXCP4z-wXCMR2E0d-SBhg3UTqq6FDgRpbrA3qva14__bU&__tn__=%2CO%2CP-R,128,36,20,"Concluimos las actividades legislativas del dia con reunion de comisiones unidas de Puntos Constitucionales y Anticorrupcion, Participacion Ciudadana y Organos Autonomos, analizando reformas a la Ley de Instituciones y Procedimientos Electorales para el Estado de Quintana Roo.",2023-10-30T22:17:43.623784,30-10-2023,10:17 PM,NORMAL
rossiagustin,https://www.facebook.com/RossiAgustin/posts/pfbid0ukfA4qKfM7UzVTJN71X8o6at9AgXBKVPfiYpBLpbRVf4fQvde1gnLysQUqquFpBbl?__cft__[0]=AZXWK0gTIvsDhMXNv-uHPjQAoyG7XhhnWSq-Sji-oBZfM37Q5s6mCM_-uvll7FBdGWCsD1lM7Y-XhdGM1Bz6OM6OJcEkPfeAlCAdPsarEbgND__6YBtO-sP-ydZz8kt46Y0Y8XNh_435UPU9qKe_OBxfGB4FThnfpmnRjyF3AW7izvu2iXenJx9dXFOx-kyHCeX39R_TONgkYkd27SGft-Gt&__tn__=%2CO%2CP-R,0,11,4,"El valor de la palabra y las prioridades claras. Estamos trabajando sin descanso para devolver el poder adquisitivo del salario a los argentinos y argentinas. Sergio Massa prometio y cumplio: hoy, el 99.2% de los trabajadores y trabajadoras no pagan ganancias. #AlivioFiscal",2023-10-31T08:17:04.803587,31-10-2023,08:17 AM,NORMAL
