Nombre_pagina,URL_post,Recuento_compartidos,Reacciones_totales,Recuento_comentarios,Contenido,Fecha_hora_publicacion,Fecha,Hora,Estado
ptomorelosayto,https://www.facebook.com/PtoMorelosAyto/posts/731605609013717?__cft__[0]=AZWH3Lb1HQI6lIYiU-Tm0N0lOKoYUzuYhePBnB7DPRls9n_QfiGc3gVn3RTJ1X1JbsNOybewnwihxFoOmfyCxREQfpysOQwz6MZtrSW6OesjTikeBwQMYwyHhuifaY8556ZCMwPEaxQCVmhoQ27mvY1cMXoQOgIB4Sf5bC1YUqmxsA6Z3H-NM2AqxkQ3l32rbmveZnBjuGKwYLFot0pOeqMx&__tn__=%2CO%2CP-R,0,13,11,"El #DiaDeMuertos es una celebracion ancestral que honra a los seres queridos fallecidos, a traves de los altares se cree que se tiende un puente de comunicacion entre ellos y los vivos.",2023-10-31T06:42:31.451433,31-10-2023,06:42 AM,NORMAL
lululatife,https://www.facebook.com/LuluLatife/posts/pfbid0257ehwGE1Mx1KBbhLBGMTUPwwVRdSRMxCnJeJNJC2gMMowje54Hn273yTXNAZxWMcl?__cft__[0]=AZX_LeqC5F1Q_V8ji3WRcnC0q579YaUITE5HJ4-HuS0mVcZV5aqQdU5MxvXNC9I5Oq0pngwk_VxFDoAUF_JKrtv-zokXasNOeVlxK9dR645oF-fliVnDjGoftJ_NY8QcW_ZEJT-AmspZ27xA80jNamgRSVM97zOGEYFQN43inYhTq4ZSxc51a-_rV6-RJI8DOMuHHvbL4LO0yoKPwzyxDnQe&__tn__=%2CO%2CP-R,0,5,0,Un dia para recordar y honrar a nuestros familiares...,2023-10-31T07:02:30.690298,31-10-2023,07:02 AM,NORMAL
hugoaldayn,https://www.facebook.com/HugoAldayN/posts/675458547895305?__cft__[0]=AZVy08dJqFtAAAhkhkBcKmzGg-E8GAHFVXcavdb1NI7kyUtPnwMHpNMavIU0cUrs_S1mrRJzKfCr7RtmhbPRJsczjsvoVSDN6oirHw3J9VMup5shHFg7OOWQln082QFYYghCjgu0duRQhPT3lPmuMr8UC6gWOQ8xsyH19HCoEeY5hORMuwXP7a7RG0q4ZxhSqB-sFHUqlZhdnwU1WJall18c&__tn__=%2CO%2CP-R,0,1,1,Ya fueron a ver la decoracion de Dia de Muertos en el Ayuntamiento de Cancun?Vale la pena ir. #DiaDeMuertos,2023-10-31T06:43:31.035372,31-10-2023,06:43 AM,NORMAL
maralezamaoficial,https://www.facebook.com/MaraLezamaOficial/posts/pfbid02aAsZRsBNseefsYwwD4u71ox5Kns3XHhQH5Gf2bUjHq5g42HvppNXXi81f85gRdxQl?__cft__[0]=AZWfDA8-yMJC6G8R9XEdKoCM4cOfg1_refyRfDl3Fu9HYDOtRrszOfAz0PqcncoxgIyVE_SfTrE-uahN7IP9H8qqmOSjrFEL5309VUaL62eFzU8j-fKsw4vrbs3tdtsEAm6I7-ABWbUncuhHHZ3qKvjq0S8dMPyZgD_bnztDiZ9eXZ0JSt6M9uMek4IJF-4xkgSKaOP9cFOAJDA8q3PkyMCI&__tn__=%2CO%2CP-R,62,495,44,En camino las primeras 50 toneladas de ayuda para nuestras y nuestros hermanos de Guerrero. Quintana Roo esta con ustedes!,2023-10-31T07:30:52.644025,31-10-2023,07:30 AM,NORMAL
maralezamaoficial,https://www.facebook.com/MaraLezamaOficial/posts/pfbid0iVaitt1PhYGFUU57NnjcyhuoXNoBCFL1hkfHHoS7nXzvr58zmoW5xNaCAbkiTUuMl?__cft__[0]=AZUiv1DKIYPdRwppHaYuwi2uD0urbAcqOYnU7Jx8IWardKiYf1FnWQrB9BAWICBZddB2_o_s7f-rLY-ugjL8S5_e1krJqzP8P0GFxE9JLOLDJykBNXRPucKtv3Kv-HFkVANPn7i1XYK7KVOSWXrfUzNQ267Usa38VBLYIEsXT-XNX83I9tE1PFOcqec34UFYZS0-1sWF7ISkYeFfj4TXBlAW&__tn__=%2CO%2CP-R,88,237,21,"Quintanarroenses, esta temporada invernal es importante acudir a aplicarnos las vacunas contra la influenza y covid-19. Aqui les comparto la importancia de aplicarse cada una de estas dosis, para protegernos contra las enfermedades respiratorias. Acudan a su unidad de salud mas cercana y pregunten por el esquema de vacunacion. #UnidosParaTransformar Secretaria de Salud Quintana Roo",2023-10-31T06:43:14.221027,31-10-2023,06:43 AM,NORMAL
ricardovelazco2022,https://www.facebook.com/RicardoVelazco2022/posts/pfbid02L2vVLEdUg59EaDJb5AzYR146ypb7z2erYqsmqcVCqmhTErH1cZo6evSGfwGsmd19l?__cft__[0]=AZUOSCZ4nP1ZAMEJ_YUgfImDGNT_8CiAH9IlmOUd0_gynQQFyZUsGoHaMPxNpoOsS_vnEyq7vPl06x5PnnEzOEWjmhSpHP3EJIGzVOL9Z9tjFqcDedy8gaE1NmyvbR2f2-mCy2lyBiTuT0TUvaWA9aJIlEIkoq0SOGloojo_JBZ8J_jGedDwRk7h6u4-UgYS-cyAt_vrqh029wrhKZZwd-GF&__tn__=%2CO%2CP-R,0,12,18,"Presente en la Reunion de las Comisiones Unidas de Deporte y para la Igualdad de Genero, con motivo del estudio, analisis, discusion y dictaminacion de la Iniciativa de decreto por el que se adicionan y reforman diversas disposiciones de la Ley Estatal de Cultura Fisica y Deporte; la Ley para la Igualdad entre Mujeres y Hombres del Estado de Quintana Roo y la Ley de la Juventud del Estado Libre y Soberano de #QuintanaRoo. #UnidosParaTransformar #trabajandoconelcorazon",2023-10-31T06:43:39.315674,31-10-2023,06:43 AM,NORMAL
soyanapaty,https://www.facebook.com/soyanapaty/posts/pfbid02CNmMTz84zdBo6Li8UVFDFQGipikCxxKgfovHRr7W5qdctVMYN3m9ysqNTgs65VZrl?__cft__[0]=AZVltR2MLzMYCBpFtF1Nzmy2Bq4UELKLfXLFITE6u9LT6o46PrdieIrHVM-x6gVUnGTU9szUWM2b5wX0Rg2FY5Xy1lWIuVBfU_wzaSlZS2-8-PCTayV0JNvH6HhVHJvxZFK0Tjt6l0v_om2LDEUSQZlElcZi7dZXVGO0CmfNOvmnMPe7XC4NFxAtmasxVkY3eWsx09NVOvigOV1t09ZkUOJs&__tn__=%2CO%2CP-R,49,29,8,"Cancunenses les comparto el programa  cultural que tendremos en nuestro #HanalPixan en #Puertojuarez este 31 de octubre y 1 y 2 de noviembre a partir de las 5 de la tarde.Recuerden que contaremos con transporte publico gratiuto que saldra desde El Crucero y Malecon Tajamar, porque todos los caminos llevan a Puerto Juarez.Vivamos juntas y juntos nuestras tradiciones, esas que nos unen.#SeguirTransformando",2023-10-31T07:07:40.433685,31-10-2023,07:07 AM,NORMAL
temistoclesvr,https://www.facebook.com/TemistoclesVR/posts/pfbid0W3GR2SC1TgK7E3Get5wW7foL3MehvMT7KosDr1rjn5GbFaXVvkEmn3GrCEu82TLMl?__cft__[0]=AZXDrRwZ8a8mv1F0A0pjFdQ-pwRB7SRm4R3leFTKtMZiCw-fZDly7oAmzmdHxrTG6kWJLkvWuDtbD5IXWC8zA8goc46H_RgPqxApjbLCyv5tj9-k4ojQTY5bYQS5eXEdvaGZ326-RsVREd9jSNKkTcbROEWZ0isRkYjOtFlSKGAa1YQkrcMO3YbO01LEJcX9rjbLyBPRTx4Xoml6oFcq5p4-&__tn__=%2CO%2CP-R,0,10,2,"El primer dia de la semana lo termine con #AsambleaVecinal en la #ColoniaObrera, donde escuche sus preocupaciones sobre seguridad, atencion al espacio publico y el cuidado del medio ambiente. Me llevo sus necesidades para atenderlas y gestionar prontas soluciones. Agradezco su asistencia y participaciones. Todos sus comentarios son indispensables para trabajar por una mejor alcaldia. Sigamos trabajando de la mano. #SigamosConstruyendo una mejor Cuauhtemoc.",2023-10-30T23:43:47.773193,30-10-2023,11:43 PM,NORMAL
lupitamurguiag,https://www.facebook.com/LupitaMurguiaG/posts/pfbid07tdP6TF53rWBW89Ab9e6nrZEnGMRsMrED27N9ztJLTU7JcMsweMMST1rjYjof4NKl?__cft__[0]=AZWQuykhKnnDV56ejNqNaruV0gyf4CLQfWNNuaDjlK4Z8FQpc86XLtXBga0BnUkg111JbttGuTO3VdhVVBu0uSHRwS4Q-944s6uEA_wDg51Gu3w4UCNroOVJ0aNYjbBwyZ2mI9xUrg-sqtlmSNYa5WLTEgluGf-g-J72N9UMiGewdNh69ZTz92DnH90R_yCWDJ8MYNhDMkfiwYuu5QoclRmH&__tn__=%2CO%2CP-R,5,43,5,"Con motivo del tradicional #DiaDeMuertos, se llevo a cabo un Concierto organizado por la Coordinacion de Delegados del Municipio de #Queretaro. Un reconocimiento a los policias caidos en cumplimiento de su deber.",2023-10-30T22:43:47.774190,30-10-2023,10:43 PM,NORMAL
soypablobustamante,https://www.facebook.com/soypablobustamante/posts/pfbid035pGzJfj787DJYPNbDZi46dTuS5JpZfM8HNXcAG6mFoxq5M61mhtpXjJNwaZvZvcil?__cft__[0]=AZUF9teckdEaPeLTgX974jxi5wYijDFSKVJxYwk8krYH00evrk6Pse61e1O0dIXuVr1HSpW1GgqQk2FxAyUW3AYxOSOQGbSs1mPchIbDDxffTa4zFM2i-Ho7DU_eSI1mfWj3_irUYm4GeSlHeVDH1j9Um5yWnDDBXufDKmHBbDmzpOuiIqrMD6BfR9aUMzP3nQo1oxVdTjheFuM7oYArTALR&__tn__=%2CO%2CP-R,9,25,2,List@s para recibir con un tradicional #PIB a nuestros seres queridos. #HanalPixan #DiaDeMuertos #Mexico #QuintanaRoo,2023-10-31T07:02:48.958818,31-10-2023,07:02 AM,NORMAL
dimenews,https://www.facebook.com/DimeNews/posts/pfbid0WD6VUg7j1pQTfqAcGKf2igUSNy5ZRMa2PNTDUALbQs7Vo5MheKwHD7XQRxn3KUCil?__cft__[0]=AZUflLCYuw4pIVWXJqxcYz9McO9O9LskOllco_ha1hUkWeagxIrp-6eycwmhY2BNBgvGB6cssNJzjLwmUwYscX141_CKVcMoyePDdChdHmMg_h-DzfsVXzgb3if4h9RjRtlgFwjVHmy8Rv-gQi-pIyyNZjsIqm4-AG50buEqJaitPJLFUtSctyAKgRcHzpBtbHwnnJEcHyhW_XyYUKXDI9elOj17wGy8s8SfTGPaGRpwBIIav2lHyZFYn6zkV-EDJAw&__tn__=%2CO%2CP-R,0,0,0,#ConferenciaPresidente | Martes 31 de octubre de 2023.,2023-10-31T07:28:31.003074,31-10-2023,07:28 AM,NORMAL
mariodelgadocarrillo,https://www.facebook.com/mariodelgadocarrillo/posts/pfbid0RkV8zkuQduUXdviLWUj7JHchZHt4H76T4bAFoHoyZwqpZkSiD1L8gN3bhbWAeiYCl?__cft__[0]=AZWAWlNUPyuQ-7GBsew4PyIGRPo0XIupG4kVZGOiuBaJG8y_tDUKacMvSPDx26vpKiwsuyjqRHxEkAUBNQoHki6HjeUcOWD-eWEr7IFWo9pNEu0PUSOas6PQlo2-0zvl-OLbIKz9QfneuikBiD9X9PUBCinKA9meSsqBEaeZP-31jdv-9A129XB4X9AR27jSepcaY6baia7GVY-Dz7OPFvg7TANINWm9tBxrYF2e2mohIA&__tn__=%2CO%2CP-R,16,248,29,"La Dra. Claudia Sheinbaum, Coordinadora Nacional de Defensa de la #4T, nos acompano en una reunion interna. Unidas y unidos somos mas fuertes!",2023-10-30T22:47:02.266611,30-10-2023,10:47 PM,NORMAL
renansanchezt,https://www.facebook.com/RenanSanchezT/posts/pfbid0q271hKvFRkA9n19kKtNfcofcp3J2L9npCMr2j6FnQKSSEo4ic27mzDhnCYEcoWRKl?__cft__[0]=AZWZ7rbOG0k381bB_CvJYLT3B8Sz3a10ie7yWxSMOjsNw4-eAN9oZpC4SCd579cVkqMODMTV3MMFi1KtkKabR_Ixf26eJ01_eYqr_-u7FIw3q43dhPEwrEU2p1orbGQAdGyRqHT-oAYcmkeku9Da8AvHeMyNWKq9lI-IgxIjC32q-k_jEQ6yx47Oe_KpdUsdASqhtQfm5bD2vVtgozBO6yNX&__tn__=%2CO%2CP-R,0,14,1,"Concluimos las actividades legislativas del dia con reunion de comisiones unidas de Puntos Constitucionales y Anticorrupcion, Participacion Ciudadana y Organos Autonomos, analizando reformas a la Ley de Instituciones y Procedimientos Electorales para el Estado de Quintana Roo.",2023-10-30T22:47:22.175035,30-10-2023,10:47 PM,NORMAL
benjaminricom,https://www.facebook.com/BenjaminRicoM/posts/pfbid0nZoZuFVumCU8kdtgnKyyzsczZjGKKSZse57TpUNHkUG8zHwLjTQUYPD6smyCPZysl?__cft__[0]=AZX6quGsZkEtSR5F9ic7OZ-ALM5GfsXfDTwE0Q4vb_PezT7N0thByD7OkfCM3X9Hi-3XEd9A6yGmGMqDwxUSjzNv_r_4cdNtJ6K7P952A6buGCwRD_0f4fHZ4qbvmB-wKD0QR7HEEbq75yDaQe-uqdHecog-zl8STXkNzFKrxL9w7Z8a_Y_4UppyLyrLTL4Z4QeK6c5Vjm6ZC8PFUMJssB1K&__tn__=%2CO%2CP-R,4,52,6,Este es el #Pachuca de mi corazon  ciudad por la que todos los dias damos nuestro mayor esfuerzo. #ExcelenteMartes #ADarle,2023-10-31T07:06:18.783358,31-10-2023,07:06 AM,NORMAL
pepecouttolenc,https://www.facebook.com/PepeCouttolenc/posts/pfbid0JDKNCF4UXxPau4UvUoJQoWN7mto5rWLbVJbbCwhfTKRYWR6pVjXpMSYoFD2JYLXhl?__cft__[0]=AZVljxGHasnKMhMQYXNfvSB-ewN2o1Bp4EQRNIBRP3LUH1S3h2ijG6LK7V5plH-EFBbs5qfwsFNmKX1xBxRMoiipnLYbjq6sTxG_mCCtuztPVZyH5CmBSe7mBhFi4kDMbog-18XKsOYuhjyHRkfhJkNT6V02lBAzIGHK_gbtlkQ0W9blXIK4-kBEkKDCR7WlUzl8VQGJp1p_4xEj0F4HTssU&__tn__=%2CO%2CP-R,1,62,13,"A la gente no le falta fuerza, le falta determinacion- Victor Hugo",2023-10-31T07:08:50.524770,31-10-2023,07:08 AM,NORMAL
100063471730986,https://www.facebook.com/cristinacruzmx/posts/pfbid031ehmYNFdZyNysQFLQZzidgRkJCrZ6mYVA4wdcc8KBvKDXbWX5wpm2FeLE8vUTpTXl?__cft__[0]=AZV2eb24F-nIicK7u9W2F2KijBHrHTIzmrRo0unMyYEvyRc3vT0gW8fvDwuIVeLr_6yxOZxbKAwWWRLyYx_XMjP6E_ij78uYK3ez-NdP1FIAX2puKvsFfgbnOLtgKqVhh3TpCtU9PcS78GkIJkCS9iQiweZy_EAODHwg6eKGHmPyjP41LVUlALtVOmb6av7E0SsCGMnt9gKFvBlqhRPH6F4o&__tn__=%2CO%2CP-R,0,13,1,Este lunes nos reunimos con nuestra Coordinadora Nacional de los Comites en Defensa de la 4T @claudia_shein fortaleciendo la unidad y organizacion de nuestro movimiento.,2023-10-30T22:48:19.665139,30-10-2023,10:48 PM,NORMAL
ogharfuch,https://www.facebook.com/OGHarfuch/posts/pfbid0d7TcqeyWREfV6Ac9K7jucpUGNuSvtJzKR7ivrLaLt6SPz62nfQboa43tKi2kHdNgl?__cft__[0]=AZV92GsEfEsB7NLBlaESBthcY4Si0uQ13Vw0RyBfjIm4cpsF1_y0mkg1ondifvkaYf3Zf68Re6XRkN1mWCi0p76tVGVRhhghcgWr4zmANgYmRH_jUS0U1xW8UtiZiXEST1qqZ0b7LBxhnEj1B2xhnF_H7EKtXAX9LVL3Inv3nlbrDkoraed50FJ9Jiz_HUZkS_BRiKK8ByF3GnkPFDHAGMZQ&__tn__=%2CO%2CP-R,57,1590,70,Tradiciones unicas! Que gran evento en Tlahuac!,2023-10-30T22:48:27.293952,30-10-2023,10:48 PM,NORMAL
danielduarte.vall,https://www.facebook.com/DanielDuarte.Vall/posts/pfbid0KGasPB79BthWTa1yweNaKi8GsQkf4MdxqZ6fJwkkqXSVc2Li5aKuL6pUHYjN8q5xl?__cft__[0]=AZUM42fqfqSHN-rXzWclihFkEZnmteO7F2KZTcVDqOedvQKS7nURf5CVLflKvcclbN2qgi_OOefpKedE5ilF_nRgXf_gfcmNhMDJvG4pdmC3Z8P0V2Z24dpHGc-MK3BiGGL9ys9-zWZomxzibcSgH65SGHn_B2maML210XiWEvoIM79Ar5JoE8qc8ZvQTe1eQsIi7AgbEnMmwDzol5bKz455_sjBpGBFJXXsN3YV-bFhQsvbLsadQNQOR51vSCUYtx4&__tn__=%2CO%2CP-R,0,0,0,Y a tus muertitos que les gustaba en vida? #diademuertos #mexico,2023-10-30T22:48:29.224999,30-10-2023,10:48 PM,NORMAL
crissalcerreca,https://www.facebook.com/CrissAlcerreca/posts/pfbid0Fe8tidjSDgwYwV8HARMr4B7RDqkJeEUTPwF1xsvx8yMDUX5xG8CconSt1eLDUgbYl?__cft__[0]=AZUtuacyJ03E6rOOBCyjn2Joebrl25fGXzlpiZrMV6ctsq1PKEIA3SJ2zX2fM9rQp8iHznwNNz4Wa8VrMXcH5X5LCm487atE7TIp4FDkIITuocR-fFsk7I1sJqiihh4uZGxH2ZsGfvSfY3DbTQzhK6k9qpGJ0kkrkcPdTn0oXoZw482PdQSeX_stfkX42KCvzpnt9Uqtx_Hr-6wb5hixKEQJ&__tn__=%2CO%2CP-R,0,4,0,"Este lunes, en nuestra sesion ordinaria numero 20, tuve el honor de participar en la aprobacion de la reforma a los articulos 12 y 17 de la Constitucion Politica del Estado. Esta iniciativa, que surgio de la vision de nuestra gobernadora, Mara Lezama, marca un importante paso en nuestro compromiso con el reconocimiento de la dignidad humana y el derecho a una buena administracion publica. Estamos decididos a avanzar hacia una transformacion significativa del estado.#LegislarParaTodos#XVIILegislatura",2023-10-30T23:48:55.091348,30-10-2023,11:48 PM,NORMAL
juanitalonso,https://www.facebook.com/Juanitalonso/posts/pfbid036NGuU3s58r3pT1NbisYhoZbNnSm87mCph5328Q1XYZEeWWt6a3AXkyBnbB2TAJRvl?__cft__[0]=AZXIZhR7X4Whwb-68cpfDHXHnyZJ6aLAj7zPVXBhl0aA34OGm84M_edw6IH65d-6zRcmRHktaMtkLNkP5rDC3Ml5rqClT8rqS-o4ODyOIkgI6hj75A6FBZSZfVqnsOcw_6qo1uZF2xxZGhA9bXb8SBfqOBRf2aG1tNNFVxD2uQl3UTzbL5LWeW9qHY_J2hwSkno8JUbjgO9U1S_h2126A2H9&__tn__=%2CO%2CP-R,0,13,1,"Muchas felicidades a las ganadoras del concurso de catrinas del tercer Festival Dia de Muertos Almas con Tradicion Cozumel! Categoria Infantil Primer lugar: Alexa Ximena Castillo Rodriguez Segundo lugar: Shayna Nohely Sabido Cahuich Tercer lugar: Alinna Karolina Fernandez Custodio Categoria Juvenil Primer lugar: Sofia Nazaret Ventura Santana Segundo lugar: Pilar Angelica Mukul Catzin Tercer lugar: Maggie Guadalupe Choy CanulGracias a todas las participantes por enriquecer nuestra comunidad, fomentar la expresion artistica y contribuir a la preservacion de nuestras tradiciones.#UnidosSomosMasGrandes#DiaDeMuertos#AlmasConTradicion#Cozumel",2023-10-31T07:32:01.394744,31-10-2023,07:32 AM,NORMAL
maralezamaoficial,https://www.facebook.com/MaraLezamaOficial/posts/pfbid02aAsZRsBNseefsYwwD4u71ox5Kns3XHhQH5Gf2bUjHq5g42HvppNXXi81f85gRdxQl?__cft__[0]=AZW6j_8V7JUCEi8cEuplOl-PGGEc_fBfWKIxRwCBXofwbDyGOIegx66N3v-xCm4Y6IqWQKCp_4kot0pSUNIaUNWfHiX7Hf7dTpFNJGlKMNzy0iOmdC9YutDmuRvTJ0VtdZ7erwjNO9pkAs4LVmzGoyml5H5I9hjfgwY3doJ-8_wjrMjWJnlwidRKAZLnUTGSEoCWsc-_A2BdZrLSBLcbTHWO&__tn__=%2CO%2CP-R,141,881,99,En camino las primeras 50 toneladas de ayuda para nuestras y nuestros hermanos de Guerrero. Quintana Roo esta con ustedes!,2023-10-31T07:30:56.940932,31-10-2023,07:30 AM,NORMAL
ptomorelosayto,https://www.facebook.com/PtoMorelosAyto/posts/pfbid0Y8VMwPwqxBM2L6GmXDkt5tns7qNQNF997DMyWF91yuB55cW2xcSFtsRGhk9HTvebl?__cft__[0]=AZUYsDCBc1w8OMVOz4in2idA3wpfWj0m5ZZ_Qnbg8gJUvjbNNMqhwlmvijA0buRiX9LmiBQ_N7g-iCtMTKpdX32lfBCiFx03Bojzu1Nqy5G_Uss8YnWCnrahRv8d6yFQu4Qn0RSlFBeg-zq0GOGWlwnkO3FXZUZDKxF79Lqv7rfJg8zcfRMXzRsHkCMHDbf7ziQix6lMpWwVXXdGeg7s9cYm&__tn__=%2CO%2CP-R,0,13,11,"El #DiaDeMuertos es una celebracion ancestral que honra a los seres queridos fallecidos, a traves de los altares se cree que se tiende un puente de comunicacion entre ellos y los vivos.",2023-10-31T06:52:38.046730,31-10-2023,06:52 AM,NORMAL
ricardovelazco2022,https://www.facebook.com/RicardoVelazco2022/posts/pfbid02L2vVLEdUg59EaDJb5AzYR146ypb7z2erYqsmqcVCqmhTErH1cZo6evSGfwGsmd19l?__cft__[0]=AZUC4WYkyxlPMLN5R46Uw9j1hwdmVuyTeZoT9RgQK5MoG9jLLHIkvFDy4_ZrKY3fAmoaWt6NQW43W09XYdRkm6XPCn6DDO8nCzfJWDY4MLDY1gV5Mibef4Ep7I1sErcFUUZIKbH_qPIyvjt6LU2SbNReHlHxksDBTXN_L23jQqXk89jsYJVDUh1H15JPEs4uRaN1yiwvPoKcDQct1DSML-6U&__tn__=%2CO%2CP-R,0,12,18,"Presente en la Reunion de las Comisiones Unidas de Deporte y para la Igualdad de Genero, con motivo del estudio, analisis, discusion y dictaminacion de la Iniciativa de decreto por el que se adicionan y reforman diversas disposiciones de la Ley Estatal de Cultura Fisica y Deporte; la Ley para la Igualdad entre Mujeres y Hombres del Estado de Quintana Roo y la Ley de la Juventud del Estado Libre y Soberano de #QuintanaRoo. #UnidosParaTransformar #trabajandoconelcorazon",2023-10-31T06:53:35.986982,31-10-2023,06:53 AM,NORMAL
hugoaldayn,https://www.facebook.com/HugoAldayN/posts/pfbid02BCcpbXAhh2zpDdvTZDyKKXzyBsKr68REon2R9kpZoMjc1X1NwWQY4u63xEV5qDvBl?__cft__[0]=AZXwWd8wkJBjK8MQUcFstPFCArBkwlPTE_tdTFRxwuVlb97M8UMrjz4REqgBEY3g4kfdMaEA6yvlBH21aFJLY2CYdudzrSAq2VQCiNqqi67TmbaGfL5Q4zIQjWWY9swH3sc_GaBin7ANgpmp91SBaTZBJsLudfiIdzBhLUW8zT1q2cOReDvpZjMDuWogICP1qN4F5UPYLkq4EuQ1T11CQP_u&__tn__=%2CO%2CP-R,0,1,1,Ya fueron a ver la decoracion de Dia de Muertos en el Ayuntamiento de Cancun?Vale la pena ir. #DiaDeMuertos,2023-10-31T05:53:36.415834,31-10-2023,05:53 AM,NORMAL
soyanapaty,https://www.facebook.com/soyanapaty/posts/pfbid02CNmMTz84zdBo6Li8UVFDFQGipikCxxKgfovHRr7W5qdctVMYN3m9ysqNTgs65VZrl?__cft__[0]=AZXWP1E__hp2PI0ae9EEn8DEcEoEAyGsgoZL5WFu4_0JIm6oVpfW5iDYnq9DghZq8b8xRhT5kClo7pH9WIyl-g_LHGxHMny6McKhSvjLfRkBWDIjW00o1R-RSHwgMI2v15_AULDVj-M-HnJKll5I8bd0yk_uCVDeYeQoMcC6Xc6kPF5pe8bO0qeezzLDqA9zVxcdQSGrHGAXneNLV3W8-O08&__tn__=%2CO%2CP-R,54,34,9,"Cancunenses les comparto el programa  cultural que tendremos en nuestro #HanalPixan en #Puertojuarez este 31 de octubre y 1 y 2 de noviembre a partir de las 5 de la tarde.Recuerden que contaremos con transporte publico gratiuto que saldra desde El Crucero y Malecon Tajamar, porque todos los caminos llevan a Puerto Juarez.Vivamos juntas y juntos nuestras tradiciones, esas que nos unen.#SeguirTransformando",2023-10-31T07:07:41.319721,31-10-2023,07:07 AM,NORMAL
lululatife,https://www.facebook.com/LuluLatife/posts/818056390325281?__cft__[0]=AZXtnfpGlZreQaoyqLkDBgOEWtZPO6rmQonnURN0r8IUZX5bFTfkJsNO1qdGxBC8e9N6SwZGzaP18C-oAOixwl2qcDuNI1munrtHuCz_uP6lQzAE-YmiOv68zHL6g11usUkKaeyZR1FaTPlaGKw92nuujigXfa-I6UUj0vYS5pyII2bX3EZFAcVRrDXhSqtxlzTN1_MuyLLsfkc813xgle0N&__tn__=%2CO%2CP-R,0,6,0,Un dia para recordar y honrar a nuestros familiares...,2023-10-31T07:02:16.921270,31-10-2023,07:02 AM,NORMAL
lululatife,https://www.facebook.com/LuluLatife/posts/817803963683857:1045446939930051?__cft__[0]=AZUVTkibWOaG4-9byT44oqL-d4yBSfKBZlTCloVEjFzAm2MtYLA7qmbNAv8F6tYpuN4ry7OAtr-rC5IHGABHPqGAxNbntLfkP4JoM8SkhBPcGWkBEgzdSgTu_-QV5P4ha8ICOxZ6KfuydxSYLAbMfHiryVNau8XbbqgRmsJMyb1UqNZpqm9RReu4BvsvaWzZNPd-qtX_kRkrlflk1HGmOW75bBi1R2csuzFX2vwvwM2wMg&__tn__=%2CO%2CP-R,0,11,0,,2023-10-31T00:53:23.833017,31-10-2023,12:53 AM,NORMAL
lululatife,https://www.facebook.com/LuluLatife/posts/293535793585777:293535793585777?__cft__[0]=AZUjUZvFGzIOrKXzU-5BpkxPebTimutZPo5m9lAblSeDjztvZaRn7ldqbNqh9nospeP1jHBi-tOouSvUGc_6cTdqs6JYQejkhXbcohwHczkiQ2KUxYDhMN5zgQ_CqhBHdjuKxvJZS51EW1qHd_bBAbODCI3BIJMpOxOQCkLo0Vj6JMXW2M459vfLNYPzY7bsNbSy5cwpPEqfRbtF7rg6Pkm3&__tn__=%2CO%2CP-R,1,18,1,,2023-10-31T00:53:24.069386,31-10-2023,12:53 AM,NORMAL
lululatife,https://www.facebook.com/LuluLatife/posts/817795620351358?__cft__[0]=AZXurjW51N7xyzKiA58Q8VtuxfvAy_pTvQIW6IBzWuO9KWQFUGU81RrKj6sJbe2eP-tHVaYSjLprFTFeyp4Z3PA9VLKIKHrOx7bxQebeirmduiUPqRIePh78GsPD9erxb7pWaMeqLxe-0Qrwk6ymkS4_xlnoy1QRylz5egiVzeO8lpL5vNAKM1tdDB4968XL19p2aIg_GmlUBpyG7AD1F2Iy6HYBMeiwHIRbCKzn4C4i5-8NTyJy9BNcMs8OVwyfv0E&__tn__=%2CO%2CP-R,0,5,0,Un magnifico evento que nos permite celebrar el 113 Aniversario de la Revolucion Mexicana!#L4TIendoPorCancun#BenitoJuarez #Cancun#Deporte #DesfileMilitar,2023-10-30T23:53:24.329721,30-10-2023,11:53 PM,NORMAL
lululatife,https://www.facebook.com/LuluLatife/posts/817786833685570?__cft__[0]=AZV8BGQXcmWx_hI9EkKQpi3SGQV_q39lWTFLeo8WsLN0NmOTT3Sk29r3Tepaoizq4scxVerMKCRwNlxQCZhSmR7EXWMSQ6kCDDHDs65RBUJDBva1FwEIWME59wWk1HELMZJ4c9cvYzzA8peR8qcitfGMbT_vfdf26u4L7KNjH-wkZmgF4yNL2NgKHBI9MPFGAeWv5bf6SXzkuIq6mlkkXbqy&__tn__=%2CO%2CP-R,0,8,1,"El dia de hoy estuvimos presentes en la Vigesima Tercera Sesion de la Comision de Salud Publica, Asistencia Social y Proteccion Animal.#L4TIendoPorCancun#BenitoJuarez  #Cancun#SaludPublica #ProteccionAnimal",2023-10-30T23:53:29.800187,30-10-2023,11:53 PM,NORMAL
lululatife,https://www.facebook.com/LuluLatife/posts/817764247021162?__cft__[0]=AZXWSuotwqZXPYI06op4KKWX94b7anBooEwvI84WkfTMwqhOlIeJB6Kx4u3lyPG7sVHtL6H4Xf_3RtFC1m2A8e05lfbUM-pWRk5V9qiPv2JcopBXOP7Vj56Z4j9GUgNF2bRfB6Rl-PD7SIOBkcssHf71zjH2RjResPu7Dt5D1EayfWJmURmgZUonTXJ4XPyxiRvYxPzkGNfMRZx0jyKw4SEu&__tn__=%2CO%2CP-R,0,7,0,,2023-10-30T22:53:29.943803,30-10-2023,10:53 PM,NORMAL
soypablobustamante,https://www.facebook.com/soypablobustamante/posts/pfbid035pGzJfj787DJYPNbDZi46dTuS5JpZfM8HNXcAG6mFoxq5M61mhtpXjJNwaZvZvcil?__cft__[0]=AZV02y3crM9nBfH_Cy8bibh2JjAAULnModJALuT35xO6DjvgDAe8Y0xmHamvaBrj3gFcHE49iGMQhMrd0a8njrUhq-5dgemmxMPGZMCBeQPaK_kRwBkSb-ewVPMGmoY3rrW24nyY1kKTV8dayGjsyG1CiE3fafqew4FgfBXrsZ6CaU_eblhwwNorZmJOUwNcFtFYD4DVTWNaIhWLDGG4acWp&__tn__=%2CO%2CP-R,12,35,4,List@s para recibir con un tradicional #PIB a nuestros seres queridos. #HanalPixan #DiaDeMuertos #Mexico #QuintanaRoo,2023-10-31T07:02:43.273497,31-10-2023,07:02 AM,NORMAL
temistoclesvr,https://www.facebook.com/TemistoclesVR/posts/pfbid0W3GR2SC1TgK7E3Get5wW7foL3MehvMT7KosDr1rjn5GbFaXVvkEmn3GrCEu82TLMl?__cft__[0]=AZVbwJhEPFExmr4k2J22u48QmSHtvt8n7bCBx5ZN0Bkq0LZAcQJ8-RZ-tMrZ7SLOcIAgf-mb5kpVBxUN72NlfSixpx6jPUpmk_NihxjS9fXaJ3T4ILbyK3sx3Qdpd6EubuehvYPXj2FbXyfnN_bY9dWCjqSVpDtMJ1eq2MVsQRBvJi7JuSeg7RpT732LDVpJ8PqjeCYb_R-PwIr-DvKoYWwu&__tn__=%2CO%2CP-R,0,10,2,"El primer dia de la semana lo termine con #AsambleaVecinal en la #ColoniaObrera, donde escuche sus preocupaciones sobre seguridad, atencion al espacio publico y el cuidado del medio ambiente. Me llevo sus necesidades para atenderlas y gestionar prontas soluciones. Agradezco su asistencia y participaciones. Todos sus comentarios son indispensables para trabajar por una mejor alcaldia. Sigamos trabajando de la mano. #SigamosConstruyendo una mejor Cuauhtemoc.",2023-10-30T23:53:40.681429,30-10-2023,11:53 PM,NORMAL
benjaminricom,https://www.facebook.com/BenjaminRicoM/posts/pfbid0nZoZuFVumCU8kdtgnKyyzsczZjGKKSZse57TpUNHkUG8zHwLjTQUYPD6smyCPZysl?__cft__[0]=AZVEoK5rp2BVXOnRuvvlU1Kuii6QPO0R_ygozo_IvV5pusyR9ygGcmXEapv30Z1paAJjuHwJG255-EIi61yUbrJfc7Sz2oAAGVJ_-k_T5WX7D9-leeKaX4ZXAHkPh2Qmg1ZMqV8y1MBrY84tdrXopfvzxPRSwmCCxZawoHLEBKkBMlNd0JN_ZPufoXk3h0Oe1QVoCpB8RVp6hbqpb8l-GbOY&__tn__=%2CO%2CP-R,5,58,8,Este es el #Pachuca de mi corazon  ciudad por la que todos los dias damos nuestro mayor esfuerzo. #ExcelenteMartes #ADarle,2023-10-31T07:06:38.343029,31-10-2023,07:06 AM,NORMAL
mariodelgadocarrillo,https://www.facebook.com/mariodelgadocarrillo/posts/pfbid0RkV8zkuQduUXdviLWUj7JHchZHt4H76T4bAFoHoyZwqpZkSiD1L8gN3bhbWAeiYCl?__cft__[0]=AZU3UoORyWyLPBDXsMp1defyZOntlGIZT_QmxWwTxC8TDqU2pifbXVToV_fbFBiv9q0KLGmWOI1QN09yRM_VRoNVC9agpU6yd6PAmV_g43i5hw6_ShKVnpHw-GeFU2lrmUsPCQAA63gNn0y1InyyZORdqLjC794NQieePhv1_dapTOQBUxXQZsJe7dMFDeLQXfgBFa0mrG4jyCZALa8uUa_2FOE3jKR4PKQ5WH5QMR4b-A&__tn__=%2CO%2CP-R,17,252,30,"La Dra. Claudia Sheinbaum, Coordinadora Nacional de Defensa de la #4T, nos acompano en una reunion interna. Unidas y unidos somos mas fuertes!",2023-10-30T22:57:02.558677,30-10-2023,10:57 PM,NORMAL
rossiagustin,https://www.facebook.com/RossiAgustin/posts/pfbid0ukfA4qKfM7UzVTJN71X8o6at9AgXBKVPfiYpBLpbRVf4fQvde1gnLysQUqquFpBbl?__cft__[0]=AZW3X4gWmo1q2X6LOYUM8JLHC4aGcI3L77KinrNLqYPJpNlXO6qkLjUeNxTdG7lV5UeOAB1eckmZZUzJG7L-38t1OhbLgS6eVwC-dXPpBuzg8M740U69TIuAv5DudmTlEov3veW-cv6qOMzHcG-Y2U5n5LTRwLpKuHLJfCPXTbfHp_WjcmAHHfuAbaR60Q8ocHybZ26v4tp5OhtRB7YkoxC5&__tn__=%2CO%2CP-R,0,1,0,"El valor de la palabra y las prioridades claras. Estamos trabajando sin descanso para devolver el poder adquisitivo del salario a los argentinos y argentinas. Sergio Massa prometio y cumplio: hoy, el 99.2% de los trabajadores y trabajadoras no pagan ganancias. #AlivioFiscal",2023-10-31T07:50:24.820863,31-10-2023,07:50 AM,NORMAL
pepecouttolenc,https://www.facebook.com/PepeCouttolenc/posts/888427005974170?__cft__[0]=AZWdwhLNX7KliTDQiUEe449ZCBWfCWr8I3IzZkuOji9Z7QYCgg8svRUhMtQGEXxzFVx2rmnSiYQEyC7h3b9hzBFmzGIlSCcCV9oZK9s1s2p1bzHNpujAca5I-oyQgBCZIcpwfDkjZxfprBXXuF871GlfQKC7bofLn-AJ1lX94WVQx5hUpRy8z2_m6YDfOnaS640GAW7p_ssSpltmmGOCzFFp&__tn__=%2CO%2CP-R,1,76,16,"A la gente no le falta fuerza, le falta determinacion- Victor Hugo",2023-10-31T07:08:52.020458,31-10-2023,07:08 AM,NORMAL
dimenews,https://www.facebook.com/DimeNews/posts/pfbid0WD6VUg7j1pQTfqAcGKf2igUSNy5ZRMa2PNTDUALbQs7Vo5MheKwHD7XQRxn3KUCil?__cft__[0]=AZUsxFAiZ6ZsRPoLvkZMm3Lp3O1sgJFlStpjM2A1_AexZKOXHTYtXTzyw6sz0CLz8fY_XQFG0tfXm8a3At_r7rHtmCFHfwXXhTm_dY5a9NdDY6sPW7vbds8Yjj0tLw_JULylAIm0DEEQY0JscKiNwCeyuU8PtEHqA1fNcJSFbMUENYiDZgVIt7iELTamRUCmGEYRslOFwOv1oResgX9KOa20zZDcWJYu0It5hs-O_uk6BOI4ZZ6WF2oVBc-xla943GM&__tn__=%2CO%2CP-R,0,0,0,#ConferenciaPresidente | Martes 31 de octubre de 2023.,2023-10-31T07:28:33.197787,31-10-2023,07:28 AM,NORMAL
dimenews,https://www.facebook.com/DimeNews/posts/pfbid0364US51qop5RMo6cTdNDUxXrAjhN9whc22AUjd1V1cTGbwNo4sTK1Kf1GiyikG4fWl?__cft__[0]=AZU5-DEop8HDs07sbUodCn0E-VXHnr66BbfaAYz0we5pt1tmM3npSA6MvVfZX0wPjZumdKZYDBijBk8zFCN_6NBt7Gcce7pK1JyV0SJ9gWqnvNiIlsOCAmNyE1aueCnt0qvp6LvaxAdKNlLctZgGAGvsTRXqpjahVBRvO8l2Xxkxq4NWZxI_AQAtv8_mfiZebeGeQixweKJRw8y-PJEg0zLo-MvPnrroCqFCfEjnbhRMeA&__tn__=%2CO%2CP-R,0,0,1,"#Clima | Tendremos un martes nublado  con lluvias  con actividad electrica  temperaturas  maxima de 32  y minima de 23 , mucho calor  humedad relativa al 77 %.Toma tus precauciones.",2023-10-31T07:21:48.337307,31-10-2023,07:21 AM,NORMAL
ogharfuch,https://www.facebook.com/OGHarfuch/posts/pfbid0d7TcqeyWREfV6Ac9K7jucpUGNuSvtJzKR7ivrLaLt6SPz62nfQboa43tKi2kHdNgl?__cft__[0]=AZUQdpapPFLjCPwHkJvx_YGKRZFVBcO_EihrvrtGqx-IPb0qUh1l-_PIT6vbvwC_LpH5REic6tOH8BYwEBWtq2N2rQMfAQXoH2AiAWcso3e_46jEHxaKbz2C9lSEHJCp1poXhpJTEjkcF9uji1hYqgg3Wb0-JXeRsscYCIiqoyobqKRFe7zAC21MrLM1lNa4g9ENRUhjDTZ0OIww_CFoa7S3&__tn__=%2CO%2CP-R,57,1598,70,Tradiciones unicas! Que gran evento en Tlahuac!,2023-10-30T22:58:22.336454,30-10-2023,10:58 PM,NORMAL
100063471730986,https://www.facebook.com/cristinacruzmx/posts/pfbid031ehmYNFdZyNysQFLQZzidgRkJCrZ6mYVA4wdcc8KBvKDXbWX5wpm2FeLE8vUTpTXl?__cft__[0]=AZU6Eqpeh8V0BYSFqdRADrXeutJRjeuOEFbBk-HitweEMOD_CYAFht4-T74zbH4oKXkVDPqPB_fQqLE-FCH0vOlOTvwqszJCiajlzL2PvKxqlvwrhJleq-H_wkCGBhN-bSCo1QykkoBb9vYTEwuXRzp5UuQGH1OmUijA3rONHVm5G_fmX9wEQ7oRBzMpM3ERDWCvZypz1v2L9uBmkcZ1bLu7&__tn__=%2CO%2CP-R,0,13,1,Este lunes nos reunimos con nuestra Coordinadora Nacional de los Comites en Defensa de la 4T @claudia_shein fortaleciendo la unidad y organizacion de nuestro movimiento.,2023-10-30T22:58:27.511732,30-10-2023,10:58 PM,NORMAL
