Nombre_pagina,URL_post,Recuento_compartidos,Reacciones_totales,Recuento_comentarios,Contenido,Fecha_hora_publicacion,Fecha,Hora,Estado
MaraLezamaOficial,https://www.facebook.com/MaraLezamaOficial/posts/pfbid02CxvNSNR5qoYgu6pihyGXKGMjTv95eM4Wny6TEJuPR36kFupMtRiVbcBmaPEy9D8ql?__cft__[0]=AZUnHQFijHPA814XHTNxBPjFMDHAjE1Oj6QuJwKtZng_GCHc0j3TNx4GmNscaThuqbKjHe4QeTIl-aiUxCimbGAk0bcBJYzHMHQvGCNTlntQsIxhJS4Cd_h65YeM03K8ryniNH7LXKmUPstuVTV71zyMwkzvFkB2qDE6WLPPZEaIHneHY54HurX-pgZO7AP8lt8Z9_wBsFHhw53tajNr7hKS&__tn__=%2CO%2CP-R,42,372,62,"Tras recibir un estado practicamente paralizado con una deuda monumental y un gobierno que por anos mantuvo en el olvido a l@s mas necesitados, en #UnAnoHistorico comenzamos a transformar #QuintanaRoo de la mano del pueblo. Construimos, a traves de un #NuevoAcuerdo, una nueva forma de gobernar, cercana, austera, eficiente y empatica que prioriza en la justicia social, en cuidar y empoderar a las mujeres y construir la paz, recomponiendo el tejido social.#PrimerInformeMaraLezama",2023-09-12T13:39:05.475992,12-09-2023,01:39 PM, NORMAL
maralezamaoficial,https://www.facebook.com/MaraLezamaOficial/posts/pfbid0iVaitt1PhYGFUU57NnjcyhuoXNoBCFL1hkfHHoS7nXzvr58zmoW5xNaCAbkiTUuMl?__cft__[0]=AZUQEpIUYNCeYaEd8-mgAStB_xTY-9JeOguvKllG6HTaTovp3SDCUFgi4-i2hMxrxPaO0Q9fUuQSWLCPa98X7tIKAF_72egUT-7pcH-Zblx6qROb9Y7x6CyfHRCbs3AvMGDjmUUvf6w15YsOISyG7PDLxV2DfEgkcP5eTBiD4eN5YCsqkc4ds05a-F7F0lBfTfdVBTIwHMEY0AdcoBzmclou&__tn__=%2CO%2CP-R,34,103,9,"Quintanarroenses, esta temporada invernal es importante acudir a aplicarnos las vacunas contra la influenza y covid-19. Aqui les comparto la importancia de aplicarse cada una de estas dosis, para protegernos contra las enfermedades respiratorias. Acudan a su unidad de salud mas cercana y pregunten por el esquema de vacunacion. #UnidosParaTransformar Secretaria de Salud Quintana Roo",2023-10-31T06:00:00.785082,31-10-2023,06:00 AM,NORMAL
ptomorelosayto,https://www.facebook.com/PtoMorelosAyto/posts/731605609013717?__cft__[0]=AZXdG65NilUc2baFsxGkxA_pwql9GVUI6IZwfMaYZ68UdvGRMPJvcpOC4rFMk9B2JsAE5vepsdgjrJ46cK4EY2RQb6HpXralQFmjUJgbe_6rDwVlzMSEEaQIknAanS-ew1AuUF23CVJRdQ2Ntm5w7XLNBFsLbGFT0bIpozRb8e6BPTFqkT4WhWNdPoJk7UzrvOheq0FVOzLRJF6dfI4lg9Nj&__tn__=%2CO%2CP-R,0,1,2,"El #DiaDeMuertos es una celebracion ancestral que honra a los seres queridos fallecidos, a traves de los altares se cree que se tiende un puente de comunicacion entre ellos y los vivos.",2023-10-31T06:01:10.851166,31-10-2023,06:01 AM,NORMAL
maralezamaoficial,https://www.facebook.com/MaraLezamaOficial/posts/pfbid0iVaitt1PhYGFUU57NnjcyhuoXNoBCFL1hkfHHoS7nXzvr58zmoW5xNaCAbkiTUuMl?__cft__[0]=AZWgXdC0lC1GRmlfBaXxiq0GHvzqv7GJEMzr5IEZARRiXzYEVcjCfYTtqYEvTE_g_-T3JoDiBkSUANoUhLcujHeYe-2kKnWBm9alKKH8pXazrb_fvhn4sA4HgWRoOopR5l53Ibwx3LuKVzJ7wG2MX-mzX7tbom8V21EMlEkkSj5xD59LDq56RIMkU4y3ABRE5DlHSBoNBPcNbkl8wgV_sVzi&__tn__=%2CO%2CP-R,36,113,10,"Quintanarroenses, esta temporada invernal es importante acudir a aplicarnos las vacunas contra la influenza y covid-19. Aqui les comparto la importancia de aplicarse cada una de estas dosis, para protegernos contra las enfermedades respiratorias. Acudan a su unidad de salud mas cercana y pregunten por el esquema de vacunacion. #UnidosParaTransformar Secretaria de Salud Quintana Roo",2023-10-31T05:59:20.017344,31-10-2023,05:59 AM,NORMAL
ptomorelosayto,https://www.facebook.com/PtoMorelosAyto/posts/pfbid0Y8VMwPwqxBM2L6GmXDkt5tns7qNQNF997DMyWF91yuB55cW2xcSFtsRGhk9HTvebl?__cft__[0]=AZX8V771wMMA2Cvb2Z2U0Ji5NY-Jw6kmge6X17Ip7fjlpZQJpBZXwwxijLa5rrx_lTus2KdA9uyzhaUchhR992BOjd4srG24cxQhnv4mRUbCPJ7BPcbYztdRvONKK4XtIUtyc71AI2qUp9O9lTx6xm1BJuPPBmzTybkso5TEgNLef5sAdLcxmbsNtcGi5CDZQpDhJL4-wlZ8mrh1KqjCctqf&__tn__=%2CO%2CP-R,0,2,3,"El #DiaDeMuertos es una celebracion ancestral que honra a los seres queridos fallecidos, a traves de los altares se cree que se tiende un puente de comunicacion entre ellos y los vivos.",2023-10-31T06:02:06.432667,31-10-2023,06:02 AM,NORMAL
lululatife,https://www.facebook.com/LuluLatife/posts/817803963683857:1045446939930051?__cft__[0]=AZW-9SMVY8DIOUXcB6ElpByXx9MmhyRuGQSx-y5Q7hdqzob3_P7Qsk20ZLknnCQphjBQ8rL6PuWbv8sbyBeP8bOy90A1wl5oRW-H7G0dNro0SyOtSsLNLK69Yl3_RFgdQ6kr2Ox3UYgQDAGITJEWHEgfMKsjWTHb0i1pv4wI3kMSahoTfk00Xz4l9f5SBMNbXCldFB2cJD-pu9DrCOhxcjXoqzbHHRYGD4CJuBgxi7F83A&__tn__=%2CO%2CP-R,0,7,0,,2023-10-31T00:31:10.595698,31-10-2023,12:31 AM,NORMAL
ricardovelazco2022,https://www.facebook.com/RicardoVelazco2022/posts/pfbid02L2vVLEdUg59EaDJb5AzYR146ypb7z2erYqsmqcVCqmhTErH1cZo6evSGfwGsmd19l?__cft__[0]=AZUsrUsDTuXDJdinM4TUldX1LWRc9pyIdBT21fu0ULtnGuxSl9_M2tLxl0oaeGgOhEcqoCYIybOc9zFq6C9iy1d4O2LrIhlSV74iJ7UzDQ7YFqoFYAwaxG8Vc5O64A9-792tYMsvVU9mCzD40VMqBABLdCNp9aNiyu86vGMKy1_nhy1cUjUJGTITYzQYn8oPVz8VCXv-QoFg1F0SK6lz6R9H&__tn__=%2CO%2CP-R,0,2,0,"Presente en la Reunion de la Comisiones Unidas de Deporte y para la Igualdad de Genero, con motivo del estudio, analisis, discusion y dictaminacion de la Iniciativa de decreto por el que se adicionan y reforman diversas disposiciones de la Ley Estatal de Cultura Fisica y Deporte; la Ley para la Igualdad entre Mujeres y Hombres del Estado de Quintana Roo y la Ley de la Juventud del Estado Libre y Soberano de #QuintanaRoo. #UnidosParaTransformar #trabajandoconelcorazon",2023-10-31T06:10:14.766659,31-10-2023,06:10 AM,NORMAL
soyanapaty,https://www.facebook.com/soyanapaty/posts/pfbid02J6SFcFcWcYp9YiHjVoAeDS6dWQmU1jC4KhRq9gtE3dTXskjPQwsoyd1gzqc5Pt19l?__cft__[0]=AZX5Yzg82NqrEKyNNOtmT8jSqT3_JrtMBZWnqO0hLNNNGDXUtcY7BQLPXGBwHr2Dec8A_jCX0jC4aEjsBoeempBdbRDhhgXLyYDsU5vU6_e4JlxjwDiwVWfeYcwFF13J-18nyVPtz5uvXW-4Cm-l0mT2od2vDQ-ZFEjvCjqNtlgum6AMl7rEQKJ8Nfp5NaXQ1B-7S8acFaBxjl29FjTV1za5&__tn__=%2CO%2CP-R,0,27,3,Son mujeres y hombres cancunenses que llevan entre 5 y 35 anos de servicio en el Colegio de Bachilleres Quintana Roo quien junto con nuestra gobernadora Mara Lezama les reconocimos sus anos de compromiso en favor de la transformacion de nuestra juventud.Cuenten conmigo para lograr impulsar nuestra juventud y el futuro de nuestra ciudad porque #CancunNosUne,2023-10-30T22:31:16.305156,30-10-2023,10:31 PM,NORMAL
hugoaldayn,https://www.facebook.com/HugoAldayN/posts/pfbid02BCcpbXAhh2zpDdvTZDyKKXzyBsKr68REon2R9kpZoMjc1X1NwWQY4u63xEV5qDvBl?__cft__[0]=AZWgkGeATjfydj3H9H3lTAgmQZ7dtEvQCTwr2pkS45Y69LtvE3YrLCnWpMq5nq56Gjrzk-qMLADiN2Xhu-KmaIQJb8x2s2kg1tVoMzDaco8OJwH4niHPKwylVlcCMHy-k7-fZN0J5i71h0AWpj1qfzPbOxBmHFVVTfjtfuYhkWsNfUYXA28HoLTL4c3nFgvGcH5C9Jj7J7TeNKcAJkQWy50Z&__tn__=%2CO%2CP-R,0,1,1,Ya fueron a ver la decoracion de Dia de Muertos en el Ayuntamiento de Cancun?Vale la pena ir. #DiaDeMuertos,2023-10-31T05:49:21.488304,31-10-2023,05:49 AM,NORMAL
lupitamurguiag,https://www.facebook.com/LupitaMurguiaG/posts/pfbid07tdP6TF53rWBW89Ab9e6nrZEnGMRsMrED27N9ztJLTU7JcMsweMMST1rjYjof4NKl?__cft__[0]=AZVOgQKDGLemJEfy4noEa-W8GOW4BgEQd7UsgzS69IGQqQekE6sIIW2jyLFictEtdbpU8I8ihPDd8yzqHITOgkzqwIy5TKN5VaB5iyK7V3LLXYzjnx6uLEfna7SmQtIxBReyajnjzdlhX17FWBMOaU4WI9WUFAk5YNVv3Zx3v0NAq3ldYdNA_vhDs63g89_ewi6j0BE0DlYVCrhmtup-k_Nt&__tn__=%2CO%2CP-R,5,40,5,"Con motivo del tradicional #DiaDeMuertos, se llevo a cabo un Concierto organizado por la Coordinacion de Delegados del Municipio de #Queretaro. Un reconocimiento a los policias caidos en cumplimiento de su deber.",2023-10-30T22:31:23.033172,30-10-2023,10:31 PM,NORMAL
temistoclesvr,https://www.facebook.com/TemistoclesVR/posts/826963976097278?__cft__[0]=AZW7k3h7z4Qh32C_YPy8HmXaRHosL5InUrSRYV0L_EGR0fnsyRUs3pbi3R5JXE59bIygRIk5-3kSi-GODmhY_3uGDWX65OswFpRSvweX5XKlh2taQD7IJcTEssZFDnOB3k1NXjWsEcffvwmtZnLOHziRbi599Ta7a3gKmr4BVbtwFJcAVy9wEKVid0Jc5IuRgQifveEku6nh-jD5SsU00EpApU_oiCJPXu34Kvkzeee5Xfl5I3HcEDfgHFAzaalsX51D_T96IDIkBw1xpNZn6oRpjhBGvi-NtzSsvfM3LWz2yQ&__tn__=%2CO%2CP-R,0,10,2,"El primer dia de la semana lo termine con #AsambleaVecinal en la #ColoniaObrera, donde escuche sus preocupaciones sobre seguridad, atencion al espacio publico y el cuidado del medio ambiente. Me llevo sus necesidades para atenderlas y gestionar prontas soluciones. Agradezco su asistencia y participaciones. Todos sus comentarios son indispensables para trabajar por una mejor alcaldia. Sigamos trabajando de la mano. #SigamosConstruyendo una mejor Cuauhtemoc.",2023-10-31T00:31:24.952041,31-10-2023,12:31 AM,NORMAL
dimenews,https://www.facebook.com/DimeNews/posts/pfbid02hfCbQe7yAEYyrvjeYLAiYQthWCNR7MXJrVZAvGP8EQ1p83RooMtevuAvEij79krrl?__cft__[0]=AZUfYZoVMM2IpsslSXqWspAXnop2vJdEl6IFENPLqGD7Yuj3Tsi5r349p-PCrQnq-aWE2IDxwE83pdfulpb_p6e0Z6oIkQS_UvuYaT81DLqYejs7U3AhRqxadLECMDG2q_CKlHeTmpU4ec-UAXbuU4rJcPqFER3FoQ0HH3orM28hhbYgXpskOpvS1_h3XFPOKBgvMcMDpy-VT5iFKpnRBtoM&__tn__=%2CO%2CP-R,0,0,0,#FelizMartes DiMe News #QuintanaRoo te informa.Mara Lezama Ana Paty PeraltaLili CamposAtenea Gomez Ricalde,2023-10-31T06:28:11.484998,31-10-2023,06:28 AM,NORMAL
dimenews,https://www.facebook.com/DimeNews/posts/pfbid0eiWLzL1VPb5mVsLvQY33LZs6sDeEGQwyimSrPLnYjtQkU2NVgeeCNGrWzkx74xLDl?__cft__[0]=AZUbgxku4UfB1K0T_dgWPgvK0kns2FRMwBieEBsBJWbgBpzIwZpiT9vbTKkQCy4fdC79cjqoOV-iv3O0OzNoHsjInqss8vG15G3muJ2Uk20ZfCGPjuuHsutbV0WtXynxek5lXfj1hRxX-cCDcl_eTJ2EUU5vmqeijJiTp6lkzTlTPSbTuKaPlYO-9-mIqxLchRt76GTtbnGAuf6WzRB-1Zd-&__tn__=%2CO%2CP-R,0,0,1,Un dia como hoy en la #historia.,2023-10-31T06:00:37.460572,31-10-2023,06:00 AM,NORMAL
ptomorelosayto,https://www.facebook.com/PtoMorelosAyto/posts/pfbid0Y8VMwPwqxBM2L6GmXDkt5tns7qNQNF997DMyWF91yuB55cW2xcSFtsRGhk9HTvebl?__cft__[0]=AZUanG0keK3Z6iIwsa2g_Wq7sDeJzDlvCnhAR80wkn6BqnumUlsRHxCCxh7yQ1gqu5b7Oo1ECOviYXggFDCUyxv5xqfnmcLbd-yvuvxFlWudP7gIaYUDKlp9qSd3BkXC3RwehVf-Dk5w0IBw7R18itr0zqq42LoFnAgWx2nFUCjsEy1TidbRvN27m4Pca2Wmf5ciwtC8CtXElxF1d6-ZEvsA&__tn__=%2CO%2CP-R,0,5,5,"El #DiaDeMuertos es una celebracion ancestral que honra a los seres queridos fallecidos, a traves de los altares se cree que se tiende un puente de comunicacion entre ellos y los vivos.",2023-10-31T06:01:28.915969,31-10-2023,06:01 AM,NORMAL
maralezamaoficial,https://www.facebook.com/MaraLezamaOficial/posts/pfbid0iVaitt1PhYGFUU57NnjcyhuoXNoBCFL1hkfHHoS7nXzvr58zmoW5xNaCAbkiTUuMl?__cft__[0]=AZVsRQdBwmwwRA2HxUHcRTBcMQAnLsDBmho7kwBg4On8FytiMUypxqfHNB9uzR8hK6v__Q3S3B4uhnGpg0h8ZhGykFlGb5dIi1OiDQMIeKlfadxzphwcuCTSs4NpUSYEgdnB7QoGxFTDLMw1wOR9bHfA12KvqGBo06JCK9qWDSIvhw6eN1Bk8q9xz7w8w2XsjDnwRz_X1s9YT34HgGoj5wha&__tn__=%2CO%2CP-R,45,156,13,"Quintanarroenses, esta temporada invernal es importante acudir a aplicarnos las vacunas contra la influenza y covid-19. Aqui les comparto la importancia de aplicarse cada una de estas dosis, para protegernos contra las enfermedades respiratorias. Acudan a su unidad de salud mas cercana y pregunten por el esquema de vacunacion. #UnidosParaTransformar Secretaria de Salud Quintana Roo",2023-10-31T05:59:11.184121,31-10-2023,05:59 AM,NORMAL
ricardovelazco2022,https://www.facebook.com/RicardoVelazco2022/posts/pfbid02L2vVLEdUg59EaDJb5AzYR146ypb7z2erYqsmqcVCqmhTErH1cZo6evSGfwGsmd19l?__cft__[0]=AZXXIXSK3-GBSgyqWs2tej_Xynxc1jKm5Q1_oTI2r2IZL9EudKy1f-0QycXrB_8vjaaZf06C9BKkiz3KBi2Ot6pGOeCelnfimj6UX2YZ0L3g8aocGDHv4xLLIzUU_3OjNO1oStQvWgAZ-MeBEnNj7gMldBLIYgmgDHQJGTcqJn7W4nEi9ke_lp9bBeziqGLxtABIlbk91UyWMPXYdSRfrnB0&__tn__=%2CO%2CP-R,0,5,0,"Presente en la Reunion de la Comisiones Unidas de Deporte y para la Igualdad de Genero, con motivo del estudio, analisis, discusion y dictaminacion de la Iniciativa de decreto por el que se adicionan y reforman diversas disposiciones de la Ley Estatal de Cultura Fisica y Deporte; la Ley para la Igualdad entre Mujeres y Hombres del Estado de Quintana Roo y la Ley de la Juventud del Estado Libre y Soberano de #QuintanaRoo. #UnidosParaTransformar #trabajandoconelcorazon",2023-10-31T06:10:10.645661,31-10-2023,06:10 AM,NORMAL
hugoaldayn,https://www.facebook.com/HugoAldayN/posts/pfbid02BCcpbXAhh2zpDdvTZDyKKXzyBsKr68REon2R9kpZoMjc1X1NwWQY4u63xEV5qDvBl?__cft__[0]=AZX_qKc0KsU2nXw3lXRC1evJAzFhuKbbxGTIgtle7fFm5E-17fI1fhFLaCMgZSq51VAH68w2zEttaQ932uiKGlCR1cgD8gg_n848ww3YSCaCR74JrWsaL6Br4gTOIZlG2l53bHqA0gOWCEirtqVmHA8AV94gNei7SLo6W6MSuzUnRbttleYEfJ9KYe-7jsYuY9Aws3K3JfhfYLeM2RwzCJYm&__tn__=%2CO%2CP-R,0,1,1,Ya fueron a ver la decoracion de Dia de Muertos en el Ayuntamiento de Cancun?Vale la pena ir. #DiaDeMuertos,2023-10-31T05:53:35.314917,31-10-2023,05:53 AM,NORMAL
lululatife,https://www.facebook.com/LuluLatife/posts/817803963683857:1045446939930051?__cft__[0]=AZUS7Bht8rAW8QHtunRCJwHp4R921Pyrl2clIN7D8ye_wX202aSX-l1Ubhgq5GhRl69TIWyDvLTp6rk5Lo9xNFIhuZs4CpUwAkr09N1xzWVkn5gTAjJgA7gyxAoJdTyi7BG42pXuusesPHnasTsDvtj29oZY5Mfntb8alwRhAscVDLAEzTqZ82ZAXGuvh_wQ0gqGnL6NoKRM-edF_X8Sz7HzTWTZ9Lk4M8edQx_WRNcvgg&__tn__=%2CO%2CP-R,0,7,0,,2023-10-31T00:53:06.639372,31-10-2023,12:53 AM,NORMAL
lululatife,https://www.facebook.com/LuluLatife/posts/293535793585777:293535793585777?__cft__[0]=AZUyj80OyF_rywKfbL9u8uIMn5uM_ETufmGbhUDD8NPquks0QSk3aYIUmcSy9p3T2L0hh0BQPoeeEYB8fII5O24_lheFZy7hga4FUeUiLY-FQJzOMiBbw-aAS0QuYkqLA-bT5p9_hekbblugJY013U3nKDeETjvNAjyEMPgVSEg6HMi5C0xxHKupz504h3glXMwNfozrwpeTTHfAjF_gS7d8&__tn__=%2CO%2CP-R,0,12,1,,2023-10-31T00:53:23.659957,31-10-2023,12:53 AM,NORMAL
lululatife,https://www.facebook.com/LuluLatife/posts/pfbid02Jf6CW5vE33CpNpVg5CP9ESyzWUMukswa6qkJrnbKvC7vL6qq9ti6BZ7mnDVZMZFcl?__cft__[0]=AZWSeKBLt2ARTWTU8i3izZETGzrXM8PqNMtgsemI3CVQ9TMNfDI1VIj_7zmywuyCvLbyVbqLv3shlIOnqQwIIXuCXanjXf0Esg-FMSd_vWvi5vrI_ZWQuo0yTlMwyf2Rr8GdfVY40t2TEabWu7aJsH25mpjUcusf3wMRnBdA1g85uZT0hzBSD5aqJbd8Nha3mzWkxq_ws_p8ytVbu69yeFgy1DucjxGqwm440eZd2WCK7-UOZMDTsl1tu_Kd4cbhvYk&__tn__=%2CO%2CP-R,0,4,0,Un magnifico evento que nos permite celebrar el 113 Aniversario de la Revolucion Mexicana!#L4TIendoPorCancun#BenitoJuarez #Cancun#Deporte #DesfileMilitar,2023-10-30T23:53:24.023983,30-10-2023,11:53 PM,NORMAL
lululatife,https://www.facebook.com/LuluLatife/posts/pfbid02PRAzoCFP7gFtZaxezir2pxJaVjPD5sufPq1einebcx3QrpNppqn12S48CdKpg7fXl?__cft__[0]=AZWPV5kBHWOM4wwC2wLg8C2Y3m3Eab-nb6QigA_3Bafxsw3IwxY_Bi8ADyYhdRR1Hcg3yyCFHQ-Rhf4TlyM2k-RtZD2AxzCyJ23qsYK-kfMFw7cZoBIwb0CMkyYfjat5aZ4oQJeqE1v8E2agB0Pknta8oTfN7iEu2x8HmEm7Xq7v-F3GXGZY4OE0qs2a7RHuYfpWfo7aTazuSdgaJGiecaJe&__tn__=%2CO%2CP-R,0,7,1,"El dia de hoy estuvimos presentes en la Vigesima Tercera Sesion de la Comision de Salud Publica, Asistencia Social y Proteccion Animal.#L4TIendoPorCancun#BenitoJuarez  #Cancun#SaludPublica #ProteccionAnimal",2023-10-30T23:53:24.727103,30-10-2023,11:53 PM,NORMAL
temistoclesvr,https://www.facebook.com/TemistoclesVR/posts/pfbid0W3GR2SC1TgK7E3Get5wW7foL3MehvMT7KosDr1rjn5GbFaXVvkEmn3GrCEu82TLMl?__cft__[0]=AZXxunXlZqMjcRJX4nj_HTUD_yB-cq1DrspWy7bT1-HHqXqi5Qc3yOfhYe1ynu6C-e9J-cRFLf1Xj8Qc0kXnoYD_1ace2jQ1qapMEvdPIlEYcR2E0qWVS2ey7plARgXDjKNay9izaET41hT0ElfCraZ4TrhrVhT2w7T49X4BkjhaXSBD-J_4Me6PxpsyX_t7C78BsHEANMbY-ds1GABrSMfH&__tn__=%2CO%2CP-R,0,10,2,"El primer dia de la semana lo termine con #AsambleaVecinal en la #ColoniaObrera, donde escuche sus preocupaciones sobre seguridad, atencion al espacio publico y el cuidado del medio ambiente. Me llevo sus necesidades para atenderlas y gestionar prontas soluciones. Agradezco su asistencia y participaciones. Todos sus comentarios son indispensables para trabajar por una mejor alcaldia. Sigamos trabajando de la mano. #SigamosConstruyendo una mejor Cuauhtemoc.",2023-10-30T23:53:54.287287,30-10-2023,11:53 PM,NORMAL
mariodelgadocarrillo,https://www.facebook.com/mariodelgadocarrillo/posts/pfbid0RkV8zkuQduUXdviLWUj7JHchZHt4H76T4bAFoHoyZwqpZkSiD1L8gN3bhbWAeiYCl?__cft__[0]=AZWAZMyEo8nbSAdNd7RsZeuouCzHI_jBUNkmemJxbTVAS6GH9SdzZyBA5h0KWhZYDYTjUQqWupXHW1ELTF9ZkqCeYpSPiXydWCA2t3p0VNiS_BI5th6L--wKt-EC9cEvq1LY5GtULFgxHNFThir32XtlqKn9l0uAuQfXkmgXbFuqw60iEni57qQCSVZuNUZVhbCqEzqAEJb0SVKyyLX2V5RkIb6LREf6VkJLKD12beNTnw&__tn__=%2CO%2CP-R,15,237,29,"La Dra. Claudia Sheinbaum, Coordinadora Nacional de Defensa de la #4T, nos acompano en una reunion interna. Unidas y unidos somos mas fuertes!",2023-10-30T22:57:24.328566,30-10-2023,10:57 PM,NORMAL
dimenews,https://www.facebook.com/DimeNews/posts/pfbid02hfCbQe7yAEYyrvjeYLAiYQthWCNR7MXJrVZAvGP8EQ1p83RooMtevuAvEij79krrl?__cft__[0]=AZUrx3lVCNTsuSDlWZFsirKIIKJBb8arFmSy1bUH0k4WI68b8SwkvdzrQGy_fmQDYjDRkDGyR0xwKEa522pqE7Z-p3ZlaKJ3-bsKvXZrN8zhdUs4Rgr21UxbeK7vInCNPoNV3KJV3CqAvzWlHc5EK4IWLw1lLbtGk04T8ORJsvyP1TQ3_dyB14F7ahBWdDwAw83C8J4a68FGqZKKyFj1t55R&__tn__=%2CO%2CP-R,0,0,0,#FelizMartes DiMe News #QuintanaRoo te informa.Mara Lezama Ana Paty PeraltaLili CamposAtenea Gomez Ricalde,2023-10-31T06:27:37.444850,31-10-2023,06:27 AM,NORMAL
dimenews,https://www.facebook.com/DimeNews/posts/pfbid0eiWLzL1VPb5mVsLvQY33LZs6sDeEGQwyimSrPLnYjtQkU2NVgeeCNGrWzkx74xLDl?__cft__[0]=AZUY0zWSCmlN63LjLm5svEYgzGh_vQATRqMjBqwtUqjboa579n9ypavzUyM1kFOb6tpcf1jLDOIc0JUriIQ1FmpLMVJu0gyf6Kxm_o5iDjjN7SaVVO536B2n78IB2KPvyfLBHI4P99DUpjrXvdXcsSlPUIqdI-bff21tI_DzeoBtIrKWqtHGroP-Q46rxmVjroYf65xIQ5nLM-EQmBYBDhOC&__tn__=%2CO%2CP-R,0,0,1,Un dia como hoy en la #historia.,2023-10-31T06:01:17.074929,31-10-2023,06:01 AM,NORMAL
ogharfuch,https://www.facebook.com/OGHarfuch/posts/pfbid0d7TcqeyWREfV6Ac9K7jucpUGNuSvtJzKR7ivrLaLt6SPz62nfQboa43tKi2kHdNgl?__cft__[0]=AZW8EQXPDahumQV27nGpP6TUidyZGbWw2u3jks8chrfpB_i4UBT1QRq4VQVVxk-6Gy0xxdt0BQzs-YlR7x1kCKBzrrIOpaoZmaF1JeHleiN0FGvsXcATkwp8a1oaA345I41VtaO2yg7g7NPuSJ0zktMYJsZdKcN094e6WmopB1nuPIRC7vEUBqOO07JxIyxrhy-MG6bIMUu1qFNprh6uGXj7&__tn__=%2CO%2CP-R,53,1509,68,Tradiciones unicas! Que gran evento en Tlahuac!,2023-10-30T22:58:23.675554,30-10-2023,10:58 PM,NORMAL
100063471730986,https://www.facebook.com/cristinacruzmx/posts/pfbid0woG4MhKoieaCQT97pQSRiCXiycDmRmKa5jhRVjNQHAmobYvZ4JaDvfEaGC5r4NPel?__cft__[0]=AZWoyIPDfWmCF7Yv5S5mFZ30lf1tiGOJh_hp5f-vYG92cf8nQb6B4LUAMLEgNS-vNeVhin5PySbDgYakrlY-O0jbN6xrJcNWSZ13MfSQqXlKSI3d_hVUW-N1cvyJdDZkgJ0a4RXPcKA0HeoegMerYmfiNSjCP1DDycc0FDqvbU0HNe_Q2iC8WpW2qIBOXSmgyHHrvusJfSWzG574MTUWmTVw&__tn__=%2CO%2CP-R,0,13,1,Este lunes nos reunimos con nuestra Coordinadora Nacional de los Comites en Defensa de la 4T @claudia_shein fortaleciendo la unidad y organizacion de nuestro movimiento.,2023-10-30T22:58:16.671812,30-10-2023,10:58 PM,NORMAL
danielduarte.vall,https://www.facebook.com/DanielDuarte.Vall/posts/pfbid0KGasPB79BthWTa1yweNaKi8GsQkf4MdxqZ6fJwkkqXSVc2Li5aKuL6pUHYjN8q5xl?__cft__[0]=AZWt1MnMGSh3ALCL-QxMgVpv7D5QZBhUpIJQCzzUCUpUJSZtcpGbXiTqv_RxndYG32XMpn3IyqwItSMLvRyhWv8NEMQLGiU2Qml7uENkMJw6Yu2xhtRPKDrb0S52s-Z8hnM_Pm9MbWs3JXjxF7J6gVr5maNnkArnE3PHQ0CQl-Ob5VJzAN7iUm3nyO-Dx1pQCxEeCXr9x1Tgu6ViWB2ZAJ234LAgPmnYP4ZRfzGqgyIncGpXGMwvVRWKNQ0B1Fp6m74&__tn__=%2CO%2CP-R,0,0,0,Y a tus muertitos que les gustaba en vida? #diademuertos #mexico,2023-10-30T22:58:25.360050,30-10-2023,10:58 PM,NORMAL
crissalcerreca,https://www.facebook.com/CrissAlcerreca/posts/pfbid0Fe8tidjSDgwYwV8HARMr4B7RDqkJeEUTPwF1xsvx8yMDUX5xG8CconSt1eLDUgbYl?__cft__[0]=AZWjLKmGrVr2nDxRiON2tmVDNs_y8Y4eXFIctqVoh6LEGU9g3skNB3XXtMF3VuT1f2YdjHYGKjo6B_1vgKYV2Ef9LgX-Gp4rvwuT5DB7l6aYHJLwJzCjkZhqKVcZT3sDb5GSJgAWiIsLXhoKYzu---_UAY5N_cC32PZlHgeEmPZ4fd0R8PDeKsFG8xOXPwkpcii4ndIvBLF1hlDTMwIGe9lP&__tn__=%2CO%2CP-R,0,4,0,"Este lunes, en nuestra sesion ordinaria numero 20, tuve el honor de participar en la aprobacion de la reforma a los articulos 12 y 17 de la Constitucion Politica del Estado. Esta iniciativa, que surgio de la vision de nuestra gobernadora, Mara Lezama, marca un importante paso en nuestro compromiso con el reconocimiento de la dignidad humana y el derecho a una buena administracion publica. Estamos decididos a avanzar hacia una transformacion significativa del estado.#LegislarParaTodos#XVIILegislatura",2023-10-30T22:58:26.485045,30-10-2023,10:58 PM,NORMAL
crissalcerreca,https://www.facebook.com/CrissAlcerreca/posts/pfbid0Yg3v8jRcQp9y77KBy2Qr8theMy1NQpr7qzQN6m6xkQ9Yj85pdSQvsZRumnbmURMrl?__cft__[0]=AZVZ42spUYY9Tx3mb7_O0Wm6CjurJm997jhwaJgpej1zcKaB06FF7E4isBJTNN9dMG-IDutGW9ePJkNMH0elRQuo8z5swmvHVjn1OPre0HdT6sW_3T35yhzDlyxPUcOHGmJ3IWBBvSiChqGxXjEWwN05WPctj9B0DvrGoeydRqyjH2mI8zjFBQ_82ek1rdCOf1xwsTYM11ELRypMNYo1wPsy&__tn__=%2CO%2CP-R,0,2,0,"Feliz cumpleanos mi querido Marco Polo Carballo!Espero que en este dia tan especial te la hayas pasado super bien, consentido y lleno de amor. Que la vida te siga sonriendo y que sea una vuelta al sol llena de bendiciones.#felicidades",2023-10-30T22:58:32.912657,30-10-2023,10:58 PM,NORMAL
ptomorelosayto,https://www.facebook.com/PtoMorelosAyto/posts/pfbid0Y8VMwPwqxBM2L6GmXDkt5tns7qNQNF997DMyWF91yuB55cW2xcSFtsRGhk9HTvebl?__cft__[0]=AZUmYi9KkumoUps1qcwpmfja-Vr9l00rrvMiXK8iMbhE3od_z2vsacjskpVXxEkDhJ5seQzlyD7pyQBkTXWY0WoOmgq7RMSFaTxqSY8c98uwq3xh5HcK0Y4Sh6O9wV-VShCu-E5d-4yrNfQ8Z4QbUFETkmhexQEXYh4zeJMHo4JzuY5DJDl96aN5CHBxo3Nk6GLX7KUcdOWrKHyPvQ7cBrhc&__tn__=%2CO%2CP-R,0,6,5,"El #DiaDeMuertos es una celebracion ancestral que honra a los seres queridos fallecidos, a traves de los altares se cree que se tiende un puente de comunicacion entre ellos y los vivos.",2023-10-31T06:02:24.203296,31-10-2023,06:02 AM,NORMAL
maralezamaoficial,https://www.facebook.com/MaraLezamaOficial/posts/pfbid0iVaitt1PhYGFUU57NnjcyhuoXNoBCFL1hkfHHoS7nXzvr58zmoW5xNaCAbkiTUuMl?__cft__[0]=AZUzp5nyvoYKLhni2UTdtmj1zZVfpWEwnAQHdy8FhLzCJd4YcOaquY1IUgPZOf2cgLi7fF0_O5ZHUxkGyABTMnegr-TOyubaa8wqlPn8Vo_yLtmD-6pZ2uCdQtBS5vz939zVNX_DNjhS4Z_EG1tA4-b4SBv4mtwgvrJIPCOLf-iWKpd1MDgcdTkay9Uw844vlB5TKapq9vqCIIOzL_rEILJO&__tn__=%2CO%2CP-R,49,170,14,"Quintanarroenses, esta temporada invernal es importante acudir a aplicarnos las vacunas contra la influenza y covid-19. Aqui les comparto la importancia de aplicarse cada una de estas dosis, para protegernos contra las enfermedades respiratorias. Acudan a su unidad de salud mas cercana y pregunten por el esquema de vacunacion. #UnidosParaTransformar Secretaria de Salud Quintana Roo",2023-10-31T06:02:26.766478,31-10-2023,06:02 AM,NORMAL
ricardovelazco2022,https://www.facebook.com/RicardoVelazco2022/posts/pfbid02L2vVLEdUg59EaDJb5AzYR146ypb7z2erYqsmqcVCqmhTErH1cZo6evSGfwGsmd19l?__cft__[0]=AZWegWX6RDM7ggu9Y_nwg_4KDvay4Gy68ODjRcr-RRHyi8Zg-7BGKMp1g86mBFTNL-pLKf4sXqT2It6okDFj0UFMuTlBBT6HIlTq8NeWxuxxDpYjEi2I7DqFWil_zTDCvCMENsWuQEyp4J19rMweYCO8ONNVF-4Lwq10nBSvZ-vH0k-2ijSWCclQS49p51UwiBoDeN8YPqk1329WH2cbMnFq&__tn__=%2CO%2CP-R,0,10,2,"Presente en la Reunion de las Comisiones Unidas de Deporte y para la Igualdad de Genero, con motivo del estudio, analisis, discusion y dictaminacion de la Iniciativa de decreto por el que se adicionan y reforman diversas disposiciones de la Ley Estatal de Cultura Fisica y Deporte; la Ley para la Igualdad entre Mujeres y Hombres del Estado de Quintana Roo y la Ley de la Juventud del Estado Libre y Soberano de #QuintanaRoo. #UnidosParaTransformar #trabajandoconelcorazon",2023-10-31T06:10:33.385935,31-10-2023,06:10 AM,NORMAL
hugoaldayn,https://www.facebook.com/HugoAldayN/posts/pfbid02BCcpbXAhh2zpDdvTZDyKKXzyBsKr68REon2R9kpZoMjc1X1NwWQY4u63xEV5qDvBl?__cft__[0]=AZW_Of5vrJvZQZOeaof4EwTRa1zcupLosJbsids8nlahzbhibZX_FH9N55mRIap9w1Bvk81HAS1chyVN-NH97x8dM_c-VSjhRLZMByk4rFaGg5J1ygKk5zt6N7kw_HBK2cD9lzu1XuANbhjvJgTgpi6kflJnXrz5rzTdyo3muSBTizdlHpueBbcizB5qk5Vfuqi0LKNUTtprxhCDn0EEN31N&__tn__=%2CO%2CP-R,0,1,1,Ya fueron a ver la decoracion de Dia de Muertos en el Ayuntamiento de Cancun?Vale la pena ir. #DiaDeMuertos,2023-10-31T06:03:36.066336,31-10-2023,06:03 AM,NORMAL
lululatife,https://www.facebook.com/LuluLatife/posts/817803963683857:1045446939930051?__cft__[0]=AZXwfx7nfRbhUYFxs8nltNawVZ_rSJjVw1WkfCOuY9kaCVqmeM4TtANGgRNqUMIsrTrQXVJwyz07bpmnKG12nmwjzHTWe_u0iOPFtMXDHPfhwGo9DJzqaoohUBDzUSJ_w1gZNt_B1LlW4FF0xz4_7SvchxQkx8fXWssIae1DZTVawfq6Z9z2Zx4iC1Ve0JmU1ufamHzeSQcTTrmYGyvJkTYyxbf0kIkToHeMffDj9pFgYg&__tn__=%2CO%2CP-R,0,8,0,,2023-10-31T01:03:18.899573,31-10-2023,01:03 AM,NORMAL
lululatife,https://www.facebook.com/LuluLatife/posts/293535793585777:293535793585777?__cft__[0]=AZUVjlcK59n-LSdi4go1FCAFyz0w8L2XYa88qupTTZXHjKd-UsEGANeZIu7LS8FpwqceKP2fySvrqH-z3a2gLZIgtZ6JrIcyXgZ2oJb4SBq4gNf4vhZRRDn1g-Ib1MPzD9rfZJIRYeJZcWejiquMqk46WAZ3lpUGBDNBfCb7QvQU7JDGFkz3qGtMBDTX8yMpvgpKb_8PPWSbMJLIq-7iKlqQ&__tn__=%2CO%2CP-R,0,14,1,,2023-10-31T01:03:24.479844,31-10-2023,01:03 AM,NORMAL
lululatife,https://www.facebook.com/LuluLatife/posts/pfbid02Jf6CW5vE33CpNpVg5CP9ESyzWUMukswa6qkJrnbKvC7vL6qq9ti6BZ7mnDVZMZFcl?__cft__[0]=AZXJ7Ng2l3_kEHXwu43hX1CncEsbtCamJeK-7kJV2HaGd83d10rQpEnsWv7aMgWFK0vRUFuIe4eJGieYs7wJdJklPJXNHsfA0-GrLj7AVcr6Gl3_o7jxGcHjwRMsLjYwEk8mV_kEkXyYEKA3STcXfYO-To4weiIUXBsGI9dyXtq0aTagj7vl_-kBDqarfIw0SWJKL1eGYz-_7G9wd-UV4JzN8ZPD5prtydvy38buJl2PbX38LuTWsT1ke2-_Orvq6WE&__tn__=%2CO%2CP-R,0,4,0,Un magnifico evento que nos permite celebrar el 113 Aniversario de la Revolucion Mexicana!#L4TIendoPorCancun#BenitoJuarez #Cancun#Deporte #DesfileMilitar,2023-10-31T00:03:25.026411,31-10-2023,12:03 AM,NORMAL
lululatife,https://www.facebook.com/LuluLatife/posts/pfbid02PRAzoCFP7gFtZaxezir2pxJaVjPD5sufPq1einebcx3QrpNppqn12S48CdKpg7fXl?__cft__[0]=AZXS-9me-CMT1i7sWBw2ZmPrb4f21BqIgsOqqKhAssTUcqY4JJfLXSBDyPDdmJOPd7ydVLDClsD3TpC8qeV0TmVGPgmfp0bbdSRYP3uMwSZ8YO1nPr87m1XQi0LbC-LaptdyyF2MEJQNDEXFi1SKhAFPcbabyYJOdOjPZBtx6pE3fR-XXKm8nNzg8OXXidcHXu7gpZ6cBPDkWaW-S37yuVmu&__tn__=%2CO%2CP-R,0,7,1,"El dia de hoy estuvimos presentes en la Vigesima Tercera Sesion de la Comision de Salud Publica, Asistencia Social y Proteccion Animal.#L4TIendoPorCancun#BenitoJuarez  #Cancun#SaludPublica #ProteccionAnimal",2023-10-31T00:03:25.261814,31-10-2023,12:03 AM,NORMAL
lululatife,https://www.facebook.com/LuluLatife/posts/pfbid0oQWcde7PpDFAoK6ExZZS1oaU59uxXRb9AnG2qt5ZUbVUAJ2ThybDPERJS8SrXU2Nl?__cft__[0]=AZVbVozCUA85UJU9TkCCzZoQwKF1haxN9yFs6EL5oOMVwBzlLFe8OsKY5DAolj2kNIxy9lgRRtGkASUpJkTL3vZTKWFaTJkEu0-WOod0zdNyXh22kLNnYc0znPmX-n9XzP5FNTiUaoz6QLHdUhD1yp7M0Ikaj-fko2Z3LWveBtm9kU9vCacKdKLQ9IP0m7-1sv5abOhDzoDR_i089ugZlseK&__tn__=%2CO%2CP-R,0,7,0,,2023-10-30T23:03:31.557824,30-10-2023,11:03 PM,NORMAL
