Nombre_pagina,URL_post,Recuento_compartidos,Reacciones_totales,Recuento_comentarios,Contenido,Fecha_hora_publicacion,Fecha,Hora,Estado
crissalcerreca,https://www.facebook.com/CrissAlcerreca/posts/pfbid02EHPrp42fbKNuTy8s81b54ubXjs9CAcXVZcABw5aVJqnKrmtyrLB5enGmjSZxeonXl?__cft__[0]=AZX1ulHM1Gd86g2KvZddah8kUM3B905dfX5rsV7S6Jmpdm0s5rqUtvrT2tgE_974tZ5CMC95Tlb4miQUOYMwJFC2tKSZFJSwxkFH4oxr8-kLvZzukfzRPOJWSk8Xfr8fnPK3vlXhuf0Nep9pxBjuiZFk8i49vNa7BX5O3bUNgreFLNr7gQhI3YHwx68fVMxzU24h1JSg0icHyKE-vOzkrk8fdIkJuTVDa4IGOBpBoQLvk4jXeXWndAEdVtuYZbBrs1c&__tn__=%2CO%2CP-R,0,0,0,"Reunion de la Comision de Justicia.Para tratar los asuntos siguientes:Estudio, analisis, discusion y dictaminacion, en su caso, de la Iniciativa de Decreto por el que se reforman y adicionan diversas disposiciones del Codigo Penal para el Estado Libre y Soberano de Quintana Roo, de la Ley Organica de la Administracion Publica del Estado de Quintana Roo, de la Ley del Servicio de Administracion Tributaria del Estado de Quintana Roo y del Codigo Fiscal del Estado de Quintana Roo; en materia de investigacion y persecucion de delitos de operaciones con recursos de procedencia ilicita (lavado de activos); presentada por la Licenciada Maria Elena H. Lezama Espinosa, Gobernadora del Estado de Quintana Roo.Estudio, analisis, discusion y dictaminacion, en su caso, de la Iniciativa con proyecto de decreto por el que se reforman, derogan y adicionan diversas disposiciones a la Ley Organica de la Fiscalia General del Estado de Quintana Roo; presentada por la Licenciada Maria Elena H. Lezama Espinosa, Gobernadora del Estado de Quintana Roo.  Fecha: 31 de octubre del 2023.                                                                                                                                                                                                           XVII Legislatura del Estado Libre y Soberano de Quintana Roo ___________________________________________________________                                                                                                                                                                                                                                                                                                                                   Aviso de Privacidad Simplificado.                                                                                                                                                                                                                                                                                                                                   El H. Congreso del Estado de Q. Roo es el responsable de los datos personales que se recaben durante la realizacion del presente evento, garantizado su debida proteccion.                                                                                                                                                                                                                                                                                                                                   Consulte nuestro aviso integral en www.congresoqroo.gob.mx",2023-10-31T08:23:33.273496,31-10-2023,08:23 AM,NORMAL
crissalcerreca,https://www.facebook.com/CrissAlcerreca/posts/pfbid0Fe8tidjSDgwYwV8HARMr4B7RDqkJeEUTPwF1xsvx8yMDUX5xG8CconSt1eLDUgbYl?__cft__[0]=AZUhBtQvhLYIX4kJXb3eKkqao9kgewPRr6icSpuZqTGHws98FLpZEXXYN9AylSKvUEmU85w_N9Tah-T_UcQLasP7_mqZp8qEVgbdAypFgcpTo38O9YTxMm2yw7J06aAn_DP9uzvMu7RhrfDscar6zCd4mo7VF2V93Eu6NnhpIpuhkauZlcTjtZOOXjlwGWpAiJjzFdsI7elrA7cXCO6CLMvJ&__tn__=%2CO%2CP-R,0,4,0,"Este lunes, en nuestra sesion ordinaria numero 20, tuve el honor de participar en la aprobacion de la reforma a los articulos 12 y 17 de la Constitucion Politica del Estado. Esta iniciativa, que surgio de la vision de nuestra gobernadora, Mara Lezama, marca un importante paso en nuestro compromiso con el reconocimiento de la dignidad humana y el derecho a una buena administracion publica. Estamos decididos a avanzar hacia una transformacion significativa del estado.#LegislarParaTodos#XVIILegislatura",2023-10-30T23:28:38.439693,30-10-2023,11:28 PM,NORMAL
crissalcerreca,https://www.facebook.com/CrissAlcerreca/posts/pfbid02c3Y6kknESSXz7mP4uFfPRs3L1zkbCA8GychMeZ856ULC349adCb2CyVPx4avNuJTl?__cft__[0]=AZXXksc0Vh7D2YDgpP5H4OkA_91yJgYTeAw5wI_FqSa8KU6Equ1eq2PVXbolYC-YI50HwNd8UM7oW2H7_bJqCKlL7PQeeGZLPIfVqu1y1g9pNh6_RNWv9uLbyZTkfGxLPrcZyk1ixy1CV26aD1ibKux4ZZ23VwulxGtzPLO0IS5eJhjVGbQvnRPkPGIwMDq8oemuc4RQ0uNSd4ufYHA8wUi2&__tn__=%2CO%2CP-R,0,4,0,"Feliz cumpleanos mi querido Marco Polo Carballo!Espero que en este dia tan especial te la hayas pasado super bien, consentido y lleno de amor. Que la vida te siga sonriendo y que sea una vuelta al sol llena de bendiciones.#felicidades",2023-10-30T23:28:38.513156,30-10-2023,11:28 PM,NORMAL
anahigonzalezqr,https://www.facebook.com/AnahiGonzalezQR/posts/pfbid0nP6pPPXznJ9Nh3QXvhmRzChxGhkZTuJE96nPFmvbJaKbt4PcKSjtvHQCxc2euoTgl?__cft__[0]=AZXX7SOYL1ukHGGfcXl_FNZVWSW60zKksExbgt05HZ25ZVN05gTyimN-PpjdZh7m97w-a0_FdQrrSnC_6MCW7mnbqA76cP1-QEsvY8EiURYAGz1Ay1VreMJOtYQRuisJv49fhhHxIW8885HT51nUVKronfVYiyA41oAXcKi1SgSdLKIswzNMK4wC9A9B1N4lv5qATOWzrmYN3iHQGASq4G_Q&__tn__=%2CO%2CP-R,0,2,1,"Con orgullo les comparto que fue aprobada por unanimidad de 467 votos en el Pleno la reforma de una servidora que modifica la Ley General para la Igualdad entre Mujeres y Hombres. Seguimos avanzando!El proposito es obligar a las y los titulares de las entidades federativas a publicar un informe anual sobre las acciones afirmativas y los esfuerzos activos realizados en materia de igualdad de genero.Ademas, mandata que la Junta de Gobierno del Instituto Nacional de las Mujeres tenga la facultad de promover, de manera coordinada, mecanismos que garanticen el acceso a la informacion en la materia.Para la 65 Legislatura Federal la igualdad sustantiva es fundamental. Agradezco su respaldo.#AnahiGonzalez #Morena #4T #QuintanaRoo #Mexico #Igualdad #Mujeres",2023-10-31T08:21:55.055080,31-10-2023,08:21 AM,NORMAL
dhcaguakan,https://www.facebook.com/DHCAGUAKAN/posts/pfbid0jBLNEejMd6Sm7hEMHnRgcaqSL5mwkvQHUxPW9Y7gcuj6yz7r9LqcuZRAPFDJQGgol?__cft__[0]=AZUVoYt2ech8CdxRW7uzt2oFLLTiUwy7meuakWQccEc4X_mcbYYLM9teQDhPneXQs-3Z6PzWHTWx6pwHPm0QSMMEmCnwiOvIW7jGUxEEKSvAUcZR8rFDsHGuwpZkN_afQQ1504VqIqCPxEN5SrKIZJUbYkkOTzB7LnVtoFujy6-uFhRyMllEkW-ATl8hp2UTuME-H-g1OSA60Pg7iSMBFdSs&__tn__=%2CO%2CP-R,0,0,0,El equipo de Aguakan se dedica incansablemente a diversas tareas cada dia. Son el motor que impulsa el suministro de agua potable y la gestion eficaz de las aguas residuales. Su esfuerzo diario se refleja en el bienestar de nuestra comunidad. #ColaboradoresEnAccion,2023-10-31T08:01:22.124381,31-10-2023,08:01 AM,NORMAL
juanitalonso,https://www.facebook.com/Juanitalonso/posts/pfbid036NGuU3s58r3pT1NbisYhoZbNnSm87mCph5328Q1XYZEeWWt6a3AXkyBnbB2TAJRvl?__cft__[0]=AZXefT6ZjbL3yHDyNNpEPKYBkPTxbJO2V6yZxpLdFPhJMw2qENOYu7_LCCD2_sHOE_RkEla9Sop5NxV7T_uySevPD6BxRcGmEZGdvq-EEiEe64bjgIPs7_5CfdKC5ROmk1ElRW3Vbae9tTj7BSIwvc5_LhGlbk_iSrEMrDutkWaMJ1bWTYuUzYOZ26JVUWR0eliSuC1zW1o8ceHft4sFbGPS&__tn__=%2CO%2CP-R,0,32,5,"Muchas felicidades a las ganadoras del concurso de catrinas del tercer Festival Dia de Muertos Almas con Tradicion Cozumel! Categoria Infantil Primer lugar: Alexa Ximena Castillo Rodriguez Segundo lugar: Shayna Nohely Sabido Cahuich Tercer lugar: Alinna Karolina Fernandez Custodio Categoria Juvenil Primer lugar: Sofia Nazaret Ventura Santana Segundo lugar: Pilar Angelica Mukul Catzin Tercer lugar: Maggie Guadalupe Choy CanulGracias a todas las participantes por enriquecer nuestra comunidad, fomentar la expresion artistica y contribuir a la preservacion de nuestras tradiciones.#UnidosSomosMasGrandes#DiaDeMuertos#AlmasConTradicion#Cozumel",2023-10-31T07:32:05.366760,31-10-2023,07:32 AM,NORMAL
maralezamaoficial,https://www.facebook.com/MaraLezamaOficial/posts/pfbid02aAsZRsBNseefsYwwD4u71ox5Kns3XHhQH5Gf2bUjHq5g42HvppNXXi81f85gRdxQl?__cft__[0]=AZUivr_RCbNvwdjtL8C9kEZTwwgPGAbP8TrlRvFSP1LEbkn3zx-HHNjvZ8Lzp3A-Ibdc6Fi6K1wzgSw1QkZoQhT8MyAlU7-9F2CHhWkeFMelEOF2kXVhkanHqCcTRkK8vo-UVsaFRELbDkyKfaJpC-GNWn0QZJGNbwV_mETWqkUjEAs1y5EdXaWEXQFe8IVmmnTWsaDHHtJwvCuYn2F6y8zq&__tn__=%2CO%2CP-R,375,2081,213,En camino las primeras 50 toneladas de ayuda para nuestras y nuestros hermanos de Guerrero. Quintana Roo esta con ustedes!,2023-10-31T07:33:00.930460,31-10-2023,07:33 AM,NORMAL
eriknoeborgesyam,https://www.facebook.com/eriknoeborgesyam/videos/233432776420726/?__cft__[0]=AZWQ60YUx6a5q4vE9414UhgSXbzOpviCwX0EMTSjgIqT3JMqNy3sFQEt5dN4zQoxRfkl56dmIJvyMYxWnkhIHHkZV2NfCfR4n_P7QmYBsIcasRlsju-JtYiTzybrt1UqkK1eVSR3co27bnjKH1Z8-cI9KVLakrymmOlhhZVAp_jm5qH-fjh1ufCf30yEwH-ynAdk4zSfK-niBtStRPtUhSyJ&__tn__=%2CO%2CP-R,84,52,14,,2023-10-31T08:02:24.105073,31-10-2023,08:02 AM,NORMAL
ptomorelosayto,https://www.facebook.com/PtoMorelosAyto/posts/pfbid022mMeCLKGkq8yUGedwNw51yrMTDcpYsZHkTYSGhrQtPF4JQ6T6Gh9zKM7BhxhRxqMl?__cft__[0]=AZWXp8B6EXJdgAff5LlcX0dm0SwKev77T5QjcTFcfgpqi22IHYkaBaeWzw2VeCuwKYSmovsYgSSNq5WZHhKeFySHD228Zklix0T2ToMW38XzlUHXfrSh_QtTtS5j7uAcAvhm-rG2ocO6IQVAmJ4IiYcRZ6jWqP_Qm_jPyqDoTteDLYhJLPcLQV4AsM18LfkwhvTOWaApeqmo-psIYQDPs2ZY&__tn__=%2CO%2CP-R,0,4,2,"#PuertoMorelos preserva las tradiciones que forjan su identidad; la Alcaldesa Blanca Merari Puerto Morelos participa, junto con habitantes de la localidad, en el Paseo de las Animas y premia a los ganadores de los concursos de catrinas, calaveritas y altares.#GobiernoCiudadano #CercaDeTi",2023-10-31T08:10:19.887914,31-10-2023,08:10 AM,NORMAL
ayuntamientodesolidaridad,https://www.facebook.com/AyuntamientodeSolidaridad/posts/pfbid023TYeW9hSEZuTA6anKwD4uDByhiwvqLDah39GTLcfNjaxNSDkLja5A7dVU2cZ9Hwil?__cft__[0]=AZXbmxC4hyh9XNIlS47vSEW8LUgF9q2XFy8oQi2MN52yKs2A1BAA-wy_trExw2gZ9ffrX6f2uC5ybu6zY_GA2D0Lrv29LLy6dANP7qVddssOmK-qEMAOXpd--D5GUqAkv5cBgyBb8bhyFIpvdiUqFO35MG02kBNwL_Ph_SmgKHH3x9-wnxt3dvEcOLO3Fv1r9to1_Pa8uuLIb45kRo_dZU-l&__tn__=%2CO%2CP-R,0,0,0,Estamos renovando #PlayaDelCarmen! Conoce que significa cada elemento que estamos pintando en las avenidas. Si todos respetamos los senalamientos tendremos un espacio seguro para transitar! #RenovamosParaCrecerConOrden,2023-10-31T08:30:46.376625,31-10-2023,08:30 AM,NORMAL
eugeniosegura.oficial,https://www.facebook.com/EugenioSegura.Oficial/posts/pfbid02PEucFNwfgv4cCVeR1NssEdd3RKeHvDcf5EhLzgpF4BoRYatFSAeW2wy2hGgb1MB1l?__cft__[0]=AZXdpN4jNxKn9dWCL8hQRVSnZiipz-7vuAYnxqMapR91W3WfFvmnWxThsR5hNYKZJ9rhzj_ga7X84fOSXy7wJiV1Gvyzt0h7s_zZH5l5I6K4nGrEohE4iWDl4YULGWWwBXTrgN3aNmuRlBtkpep3yDVZrEsApd8TW6-36mTv1ehcRF31wyBwy6NcQErSt7iH_wmuYfGQK68_H_mhjDi-ylP1V5ZhRKvfuXI3xbfwpBesu5d_aPtabtwsnNHoAffL5AQ&__tn__=%2CO%2CP-R,0,0,0,En camino las primeras 50 toneladas de ayuda para nuestras y nuestros hermanos de Guerrero. Quintana Roo esta con ustedes!,2023-10-31T08:31:30.278244,31-10-2023,08:31 AM,NORMAL
ricardovelazco2022,https://www.facebook.com/RicardoVelazco2022/posts/pfbid02L2vVLEdUg59EaDJb5AzYR146ypb7z2erYqsmqcVCqmhTErH1cZo6evSGfwGsmd19l?__cft__[0]=AZXtZcD7WR82kRizpT8ETrdFud1gZduAgo5El3kbSChVVDLAuZJ6kdNQGy8hcr4OoCVW6JRFehoxyEaQV42KuGKOLff4Y41bw05GBKt197HYto1VfGhn6JqCBTDN6jUglskEZkTgcsO92ktMqcy4l72gaSQKS8rsE1xzIB32eBrMXEThWszHGqdwhseXoLr1L88dkA5poNxJ0I7aGGKoxW_O&__tn__=%2CO%2CP-R,0,13,18,"Presente en la Reunion de las Comisiones Unidas de Deporte y para la Igualdad de Genero, con motivo del estudio, analisis, discusion y dictaminacion de la Iniciativa de decreto por el que se adicionan y reforman diversas disposiciones de la Ley Estatal de Cultura Fisica y Deporte; la Ley para la Igualdad entre Mujeres y Hombres del Estado de Quintana Roo y la Ley de la Juventud del Estado Libre y Soberano de #QuintanaRoo. #UnidosParaTransformar #trabajandoconelcorazon",2023-10-31T06:33:35.377610,31-10-2023,06:33 AM,NORMAL
lululatife,https://www.facebook.com/LuluLatife/posts/pfbid025SmDMxwffhhmVStjU1uymWoUsfTiLF1q1hpHK99oBbho8CivBQcdvHd6GUp2CdLSl?__cft__[0]=AZXUC4WcfJ9LVytd0kl5UAI4MndZMniv4BWKxDltNNNhbnG0y8RBdK1ziaoiqROP8u-o5Q92AvQb5BphwfAOu2bsrURPqW-TwiN2yQ77lRU5ADZ7WQL1oWQqj0M8dFHglJNUHn1gp_clQZQn42xryW5W_tXKbRfV-hOPGwe7fbNBRzx11BdWrHf2g87coJeKEA5baI21LetrxicMbcF2a0PZ&__tn__=%2CO%2CP-R,0,0,0,Agenda del dia de hoy martes 31 de octubre 2023 de la #PrimeraRegiduria de #Benito Juarez.Continuamos con nuestra labor con las y los benitojuarenses!#L4TIendoPorCancun,2023-10-31T08:31:37.504701,31-10-2023,08:31 AM,NORMAL
soyanapaty,https://www.facebook.com/soyanapaty/posts/pfbid02CNmMTz84zdBo6Li8UVFDFQGipikCxxKgfovHRr7W5qdctVMYN3m9ysqNTgs65VZrl?__cft__[0]=AZVfu8jRFFAyC_vmWFEyxVKzvzyC4s8CaOFytBkdViSA5ShNR7fyMj1MHP5RF4Hu2RinPvUeXob1gigvNJInPpqmBWXQZKd_FBFyTkA5r1Y5eGuZsntmwi8r7us0OI_guS83KqxKhW-5RYHThxD9IbTI0ODU1e852AT-3xId8hKJ2Rrwd-rOGDxf85GpJ_IWUEGRV1FXGn0zk2tYhdYdSbFA&__tn__=%2CO%2CP-R,158,68,43,"Cancunenses les comparto el programa  cultural que tendremos en nuestro #HanalPixan en #Puertojuarez este 31 de octubre y 1 y 2 de noviembre a partir de las 5 de la tarde.Recuerden que contaremos con transporte publico gratiuto que saldra desde El Crucero y Malecon Tajamar, porque todos los caminos llevan a Puerto Juarez.Vivamos juntas y juntos nuestras tradiciones, esas que nos unen.#SeguirTransformando",2023-10-31T07:33:37.620393,31-10-2023,07:33 AM,NORMAL
oscar.cantonzetina,https://www.facebook.com/oscar.cantonzetina/posts/pfbid0mnotBkYmGkkV9GjrNyGFsFdeekVPqfzRDVQriEdPJEQZaFTx8YwQa9ke8y5jMVqql?__cft__[0]=AZVs5HTyg_J_hyDsaFt5NhDuWIycrrZzQo4ZLBzk9YNSnWLzdpjbi0pOJeywH4in2106-mcHfxr_YiJoCNo1vH8gpFkhzhKGMnM6a8SzPxfUOg8emUl-c7S-B7yyxz4ft9HGCgyj0I9ZtDtGmAVIC5VMNaOfqRVBGZ5W4nQgwHYF0oOiR2UsDf4VPnOUfEskE8Nn4eqsUIcEPo-qAFPVXKk-&__tn__=%2CO%2CP-R,0,1,0,Los intereses del pueblo deben estar siempre primero!!!#Canton #Morena #Encuesta #Tabasco,2023-10-31T08:31:41.726103,31-10-2023,08:31 AM,NORMAL
100071257616496,https://www.facebook.com/100071257616496/videos/359742363066962/?__cft__[0]=AZXC5Q0pH9H2Mck_NFIsBpor8-h0Mot08eLB6AUHsotHQCMqrylbImho19mzK61XN4lX3trSEDIEL_wpe5B5oq7Lu4wVPu134dE5GfVkGYL5J8rQCIoSMI3v3BGShQYY_ObTKmuqdusa_nLTP8WI2vnKpwLhZNbWhYnq43yUZqUZNthxHhLCgQFRXI4YCevHNllQRyDEJZJVfMoAdmOsrW8g&__tn__=%2CO%2CP-R,8,49,21,,2023-10-31T08:05:43.186324,31-10-2023,08:05 AM,NORMAL
hugoaldayn,https://www.facebook.com/HugoAldayN/posts/pfbid02BCcpbXAhh2zpDdvTZDyKKXzyBsKr68REon2R9kpZoMjc1X1NwWQY4u63xEV5qDvBl?__cft__[0]=AZUf5kQ1HrZHyI-D04_6JCvPhQHNiYB3bnZlXPE15RW7JQjgs0TWFm9olM0mpK28TnmDSuvdTyhuKK4aOE9TU8YlZkoRhzqn4icS7dbwcp42RauDbPiDmYMnf60PFsZOkg1pgj4h_yXw4OKuD2pMkEpI_brP-Jtc812V82uNeSn1xXN0SrZJ8fjsumw4S-hMkQ7GH0NuAatcdkOXY8dW3qeJ&__tn__=%2CO%2CP-R,0,3,1,Ya fueron a ver la decoracion de Dia de Muertos en el Ayuntamiento de Cancun?Vale la pena ir. #DiaDeMuertos,2023-10-31T06:33:45.385445,31-10-2023,06:33 AM,NORMAL
blancameraripuertomorelos,https://www.facebook.com/BlancaMerariPuertoMorelos/posts/pfbid0dWPoEDUBNmAy5ZQi5B72bzjqHMP8Ucgz1eEkPmC24jtLVPa1TuQAx3TkvHNk68Mhl?__cft__[0]=AZW_ozdIBRfR1ytwdvaxnLiWiE0EWYC2Ucp17D8am63JTa7gpKM1OZG7FsOMfsvFG8NOZmJOY9PbEHl5BNA6OByBquFd5kuhhhxDCypIaQmvQknNppBHWY7Gi0h0Vfpd59ZKy7p62LdUz9Eo6JJnkzLjdup2J0-mDHEnGexyltP4LGoOb9hvfJYkQajBrLaPRSX9MpEJuxvlPLzhuE4ooJl3&__tn__=%2CO%2CP-R,10,33,5,"Buenos dias amig@s!Les comparto como estuvo el primer dia de actividades por la celebracion de nuestro Dia de Muertos, en el que pudimos observar el elegante andar de coloridas catrinas, apreciamos la creatividad de los participantes en el concurso de altares y disfrutamos del ingenio de las calaveritas literarias.Puerto Morelos vive en sus tradiciones!#BlancaMerari",2023-10-31T07:58:48.157785,31-10-2023,07:58 AM,NORMAL
lupitamurguiag,https://www.facebook.com/LupitaMurguiaG/posts/pfbid07tdP6TF53rWBW89Ab9e6nrZEnGMRsMrED27N9ztJLTU7JcMsweMMST1rjYjof4NKl?__cft__[0]=AZWpDgbmwwxqYtAknnFlhU8q8CvWcnRYD_GoKJi6j5EBKxSPEyPCdOt-cWkDo-Opj2osLqNYQJAcXp85xywcSDMrTVNRuLmRosu_0t8-GLuoIrB9Ey8d1oyGevQIVr9T4CrBNqj_Yb5GJAHUQ7S13NNTGBfA-YM5ZsXWkrEyWo1cS12RYjelvPBlXq6luYDWEKOJJavRj-XHX17fRUAVXsU_&__tn__=%2CO%2CP-R,5,47,5,"Con motivo del tradicional #DiaDeMuertos, se llevo a cabo un Concierto organizado por la Coordinacion de Delegados del Municipio de #Queretaro. Un reconocimiento a los policias caidos en cumplimiento de su deber.",2023-10-30T22:33:51.562606,30-10-2023,10:33 PM,NORMAL
soypablobustamante,https://www.facebook.com/soypablobustamante/posts/pfbid035pGzJfj787DJYPNbDZi46dTuS5JpZfM8HNXcAG6mFoxq5M61mhtpXjJNwaZvZvcil?__cft__[0]=AZU4UXPdrzte4ysEXJP1MmTdbxnEvD96H2FqHSCz0pwtaSWkZ6I55bTxaTuv-2Uodwi934QSyuhjpOviJgHDJmuzddmQmglVwNTQraztYZq75ZOI64EAB3UxLzB4ISwGhtR0c21z1gKOLCM3UAYKtknFwIJPOXIRBBy74zQkINwMZrvtJnvlpsN99z900hff9lwR-_GFiApgTu5Fplw4CTHQ&__tn__=%2CO%2CP-R,75,55,14,List@s para recibir con un tradicional #PIB a nuestros seres queridos. #HanalPixan #DiaDeMuertos #Mexico #QuintanaRoo,2023-10-31T07:33:51.574600,31-10-2023,07:33 AM,NORMAL
temistoclesvr,https://www.facebook.com/TemistoclesVR/posts/pfbid0W3GR2SC1TgK7E3Get5wW7foL3MehvMT7KosDr1rjn5GbFaXVvkEmn3GrCEu82TLMl?__cft__[0]=AZX_HeXGw4cjEekHixXTOh9GaPoKflX1qZnPwHPJCsQ0Jkfrl655EbNi9IpfbFfFC1oXO0D8dnHRhFmNEbIrpLWgyQ6z1pSmJ1p2cK7a8aZdQjklBgdoSlFGhZjw-hwhm2yrvYl827uFgBi3bRn5AMzXWzj4LfA1N8y5ic9iiG_NcF2IGmSTu3GwRTkT5ihV-evJkoGQWyMJCegQlNNlZ4cO&__tn__=%2CO%2CP-R,0,14,2,"El primer dia de la semana lo termine con #AsambleaVecinal en la #ColoniaObrera, donde escuche sus preocupaciones sobre seguridad, atencion al espacio publico y el cuidado del medio ambiente. Me llevo sus necesidades para atenderlas y gestionar prontas soluciones. Agradezco su asistencia y participaciones. Todos sus comentarios son indispensables para trabajar por una mejor alcaldia. Sigamos trabajando de la mano. #SigamosConstruyendo una mejor Cuauhtemoc.",2023-10-31T00:34:13.517487,31-10-2023,12:34 AM,NORMAL
dimenews,https://www.facebook.com/DimeNews/posts/pfbid0WD6VUg7j1pQTfqAcGKf2igUSNy5ZRMa2PNTDUALbQs7Vo5MheKwHD7XQRxn3KUCil?__cft__[0]=AZVGuGO8ksAnK751-kSeFGU8S4GWOWkX3RampVGNYmRvVbs1yMLM25ARX_vNYhW8JVhhF7UFkAHQUarwI6JW_-bPdzWRtmY9JcC7Jv0qMeBV9RUt-0_cOnzfy6W-N2XUkOEPdG5LIZCqGQkMinMNbOoJaj6PdoDuceKG0wmpe5uZLhSE90r8lsio__nGh5anpK2DCjRiLOy_XHGrhb4ZerppIv0UIZ6OdfSRR6q4Dn8RMwPSqo5CfLid9UHJJMX98rs&__tn__=%2CO%2CP-R,0,0,0,#ConferenciaPresidente | Martes 31 de octubre de 2023.,2023-10-31T07:37:39.755435,31-10-2023,07:37 AM,NORMAL
benjaminricom,https://www.facebook.com/BenjaminRicoM/posts/pfbid0nZoZuFVumCU8kdtgnKyyzsczZjGKKSZse57TpUNHkUG8zHwLjTQUYPD6smyCPZysl?__cft__[0]=AZWmh0Y9urbRiX3Y9JHTUetDvcnSnJ_ZltwsMnjmS6qls_V0HBhV06_FJgcoI-6IBgJ-_HjELqY-xjBmjs_QR9lotNr4bfwDFV8RJg0HT9g7R53qYvf6rlv_AlgFNiw5WubWVsUg-P1RM9Vk6AZfiLF1QXOcNq_Hg1vTPqJZ0MVbH7CKuFkNsrYDLZgyqQQdKUTUOWMRK3Xx8IhSiPGsKUR8&__tn__=%2CO%2CP-R,7,83,16,Este es el #Pachuca de mi corazon  ciudad por la que todos los dias damos nuestro mayor esfuerzo. #ExcelenteMartes #ADarle,2023-10-31T07:37:23.368191,31-10-2023,07:37 AM,NORMAL
renansanchezt,https://www.facebook.com/RenanSanchezT/posts/pfbid0q271hKvFRkA9n19kKtNfcofcp3J2L9npCMr2j6FnQKSSEo4ic27mzDhnCYEcoWRKl?__cft__[0]=AZVZ8Mp0qwBY7v8nEFs6AWfSpwSrOtLmjw1zKYtxEmwMmflt1h7vG8e0EJCpoubVVXWzqbhHNXBWudyGTk591wj7zBbVejmI9REGN_ILQXdr9wqg2QjKOcmX4nQnNyJJeMM9x01zPoa58BjtLzLUO3PYG7WdbxSYiAg4ZvXGAAVIpastGD8gSPjotk_x5NgL015ks4nDN8o_kuW5xkDzXOvJ&__tn__=%2CO%2CP-R,63,17,2,"Concluimos las actividades legislativas del dia con reunion de comisiones unidas de Puntos Constitucionales y Anticorrupcion, Participacion Ciudadana y Organos Autonomos, analizando reformas a la Ley de Instituciones y Procedimientos Electorales para el Estado de Quintana Roo.",2023-10-30T22:37:22.148453,30-10-2023,10:37 PM,NORMAL
rossiagustin,https://www.facebook.com/RossiAgustin/posts/pfbid0ukfA4qKfM7UzVTJN71X8o6at9AgXBKVPfiYpBLpbRVf4fQvde1gnLysQUqquFpBbl?__cft__[0]=AZXFXvfxigCLnT_UJHYEgQKE85GVlUQfVX-I45wn-CqnPUaWyuZJ9BbU9VgkeQ4031u6g2AKW1eQfCOzPbrqSxFLCED0y17yc7OZfa4jzGtTkfTdGMLDWzgZxRIzwj-K1MkTeTdxZUf1JZPTEICNLHr6x6pu7h9EJ4zxmj15cIftbCHOs4xj8L0npknSOtFeDJIGs5HhdS5k8m-DQmH9Q3Nn&__tn__=%2CO%2CP-R,0,9,3,"El valor de la palabra y las prioridades claras. Estamos trabajando sin descanso para devolver el poder adquisitivo del salario a los argentinos y argentinas. Sergio Massa prometio y cumplio: hoy, el 99.2% de los trabajadores y trabajadoras no pagan ganancias. #AlivioFiscal",2023-10-31T07:51:04.752922,31-10-2023,07:51 AM,NORMAL
pepecouttolenc,https://www.facebook.com/PepeCouttolenc/posts/pfbid02MaoYpGR6ZTPN5WSgrSoaZAwrbUteLNYrN9588K7X4YGjjzW8nBGzxdQ9jfSmQ3xJl?__cft__[0]=AZXCvOW_xitCFD0od4b2PDhqXg14Yi_p-nQwH8eaQYE4yKfZ-_gLr5-jEzvj5tY9-WL0R2OZobW-svg9mQ9XoWtF03Amo-7BnMqDRgK1xVPB53xURORkLbOsUesbjGnKsqSb4edHprb9F_D9YBFrsV0jSXcVQzjy2y-Ve34R-SktfpgdmNEN3jljleFgtaNOlnvfJ0qX2UGgiLxIHfTG1W27&__tn__=%2CO%2CP-R,1,122,31,"A la gente no le falta fuerza, le falta determinacion- Victor Hugo",2023-10-31T07:38:21.675276,31-10-2023,07:38 AM,NORMAL
ogharfuch,https://www.facebook.com/OGHarfuch/posts/pfbid0d7TcqeyWREfV6Ac9K7jucpUGNuSvtJzKR7ivrLaLt6SPz62nfQboa43tKi2kHdNgl?__cft__[0]=AZWcbhTqZtm4EgW1ngeuPJPerNanHtRGqi60XpSCOEzcErS0vK8R_4S0xpgYI52iL6MoqHG1j1r7H5bn7vcLi0rGWTTrq3Wg6kHNfnVzlP28Yv84Af_HlWDK8xGNvomyz8Vpdc2bJfgzG9Xs-UL7j7YnJhmO-TOMTDy5RXsVQ1dWB5TUaa48JB1y4AsPu8n3c3lII9Q2jI6Ae-cftn10P-rq&__tn__=%2CO%2CP-R,58,1720,71,Tradiciones unicas! Que gran evento en Tlahuac!,2023-10-30T22:38:25.514724,30-10-2023,10:38 PM,NORMAL
100063471730986,https://www.facebook.com/cristinacruzmx/posts/pfbid031ehmYNFdZyNysQFLQZzidgRkJCrZ6mYVA4wdcc8KBvKDXbWX5wpm2FeLE8vUTpTXl?__cft__[0]=AZXj-Dg9mvcjOIaN1JhzCK2yK0xHob3KY9yDcxEmZAiuHiv78TXC2_xIhEkQRE69pI7lgaDVaHqrZnYLfZ3rdg0eDZ97O9f4ydl7yEb_IPnA61nCOYjwHmVS9I_fGdLopybFar3G7Pt75m2Mv6d2WkQNNmyxNAAmbAKOom5q6BYDTUqbr7rZ3JQV_sc9tJ5Z3z0iS6kNkxNC68NaPUllcnLf&__tn__=%2CO%2CP-R,0,14,1,Este lunes nos reunimos con nuestra Coordinadora Nacional de los Comites en Defensa de la 4T @claudia_shein fortaleciendo la unidad y organizacion de nuestro movimiento.,2023-10-30T23:38:27.499471,30-10-2023,11:38 PM,NORMAL
danielduarte.vall,https://www.facebook.com/DanielDuarte.Vall/posts/pfbid0KGasPB79BthWTa1yweNaKi8GsQkf4MdxqZ6fJwkkqXSVc2Li5aKuL6pUHYjN8q5xl?__cft__[0]=AZUZ1roF5znTcmA3hU4YoLQ-IMqivdi6Sb2mJxzPiy4C2h3oS80QUVTiPjTdOsYh3wyFl8Tt4DVia9z9gnuUlJkYlmk2uVOEUk503rD7SRThDJSBFANSF1fXEncEW5W7UHMmOpCDXSOZgaH3IzCw8tSMUVXbBR844ADKE_HAwB_O4utSc6EKRhY8r_I3Cg53SqSpWr_TQFei7i2tKaTs5hzYW58AyCWNL82GaH92jt5PnNxTU8RAOHqnvGkY-NpjbTU&__tn__=%2CO%2CP-R,0,0,0,Y a tus muertitos que les gustaba en vida? #diademuertos #mexico,2023-10-30T22:38:32.112677,30-10-2023,10:38 PM,NORMAL
anahigonzalezqr,https://www.facebook.com/AnahiGonzalezQR/posts/pfbid0nP6pPPXznJ9Nh3QXvhmRzChxGhkZTuJE96nPFmvbJaKbt4PcKSjtvHQCxc2euoTgl?__cft__[0]=AZU-mVSzanjZu7-lzp5gJn64atIS-9xhwZSCe3h8zZ7vJX9QIOBtlex-6qDHqQxjw1Hjf8SmXKISi394FuQZABoEyRn1cKc_LElHzEOPqSAHtJX8Zv7Z6xXu-l4cFms8WcV6UhQqladnjuwpFVNOrdrZm2QgfE7h1SccBx3OeZ6y9QBzr6Iyks2RN5qYNAsVO9h4I6Gr6mk6APIKU1UU7gXU&__tn__=%2CO%2CP-R,0,4,1,"Con orgullo les comparto que fue aprobada por unanimidad de 467 votos en el Pleno la reforma de una servidora que modifica la Ley General para la Igualdad entre Mujeres y Hombres. Seguimos avanzando!El proposito es obligar a las y los titulares de las entidades federativas a publicar un informe anual sobre las acciones afirmativas y los esfuerzos activos realizados en materia de igualdad de genero.Ademas, mandata que la Junta de Gobierno del Instituto Nacional de las Mujeres tenga la facultad de promover, de manera coordinada, mecanismos que garanticen el acceso a la informacion en la materia.Para la 65 Legislatura Federal la igualdad sustantiva es fundamental. Agradezco su respaldo.#AnahiGonzalez #Morena #4T #QuintanaRoo #Mexico #Igualdad #Mujeres",2023-10-31T08:22:35.275213,31-10-2023,08:22 AM,NORMAL
